Title,Authors,Corporate Authors,Editors,Book Editors,Source Title,Publication Date,Publication Year,Volume,Issue,Beginning Page,Ending Page,Article Number,DOI,Total Citations,Average per Year,1997,1998,1999,2000,2001,2002,2003,2004,2005,2006,2007,2008,2009,2010,2011,2012,2013,2014,2015,2016,2017
Genome-wide association study of blood pressure and hypertension,"Levy, Daniel; Ehret, Georg B.; Rice, Kenneth; Verwoert, Germaine C.; Launer, Lenore J.; Dehghan, Abbas; Glazer, Nicole L.; Morrison, Alanna C.; Johnson, Andrew D.; Aspelund, Thor; Aulchenko, Yurii; Lumley, Thomas; Koettgen, Anna; Vasan, Ramachandran S.; Rivadeneira, Fernando; Eiriksdottir, Gudny; Guo, Xiuqing; Arking, Dan E.; Mitchell, Gary F.; Mattace-Raso, Francesco U. S.; Smith, Albert V.; Taylor, Kent; Scharpf, Robert B.; Hwang, Shih-Jen; Sijbrands, Eric J. G.; Bis, Joshua; Harris, Tamara B.; Ganesh, Santhi K.; O'Donnell, Christopher J.; Hofman, Albert; Rotter, Jerome I.; Coresh, Josef; Benjamin, Emelia J.; Uitterlinden, Andre G.; Heiss, Gerardo; Fox, Caroline S.; Witteman, Jacqueline C. M.; Boerwinkle, Eric; Wang, Thomas J.; Gudnason, Vilmundur; Larson, Martin G.; Chakravarti, Aravinda; Psaty, Bruce M.; van Duijn, Cornelia M.",,,,NATURE GENETICS,Jun-09,2009,41,6,677,687,,10.1038/ng.384,810,73.64,0,0,0,0,0,0,0,0,0,0,0,0,18,67,92,116,90,70,80,76,108
A missense mutation in the alpha B-crystallin chaperone gene causes a desmin-related myopathy,"Vicart, P; Caron, A; Guicheney, P; Li, ZL; Prevost, MC; Faure, A; Chateau, D; Chapon, F; Tome, F; Dupret, JM; Paulin, D; Fardeau, M",,,,NATURE GENETICS,Sep-98,1998,20,1,92,95,,10.1038/1765,808,36.73,0,2,30,38,38,44,38,48,61,43,37,44,40,49,39,41,39,39,34,30,37
A mutation creating a potential illegitimate microRNA target site in the myostatin gene affects muscularity in sheep,"Clop, Alex; Marcq, Fabienne; Takeda, Haruko; Pirottin, Dimitri; Tordoir, Xavier; Bibe, Bernard; Bouix, Jacques; Caiment, Florian; Elsen, Jean-Michel; Eychenne, Francis; Larzul, Catherine; Laville, Elisabeth; Meish, Francoise; Milenkovic, Dragan; Tobin, James; Charlier, Carole; Georges, Michel",,,,NATURE GENETICS,Jul-06,2006,38,7,813,818,,10.1038/ng1810,805,57.5,0,0,0,0,0,0,0,0,0,16,64,66,86,59,73,71,68,77,70,56,45
"Meta-analysis identifies 29 additional ulcerative colitis risk loci, increasing the number of confirmed associations to 47","Anderson, Carl A.; Boucher, Gabrielle; Lees, Charlie W.; Franke, Andre; D'Amato, Mauro; Taylor, Kent D.; Lee, James C.; Goyette, Philippe; Imielinski, Marcin; Latiano, Anna; Lagace, Caroline; Scott, Regan; Amininejad, Leila; Bumpstead, Suzannah; Baidoo, Leonard; Baldassano, Robert N.; Barclay, Murray; Bayless, Theodore M.; Brand, Stephan; Buening, Carsten; Colombel, Jean-Frederic; Denson, Lee A.; De Vos, Martine; Dubinsky, Marla; Edwards, Cathryn; Ellinghaus, David; Fehrmann, Rudolf S. N.; Floyd, James A. B.; Florin, Timothy; Franchimont, Denis; Franke, Lude; Georges, Michel; Glas, Juergen; Glazer, Nicole L.; Guthery, Stephen L.; Haritunians, Talin; Hayward, Nicholas K.; Hugot, Jean-Pierre; Jobin, Gilles; Laukens, Debby; Lawrance, Ian; Lemann, Marc; Levine, Arie; Libioulle, Cecile; Louis, Edouard; McGovern, Dermot P.; Milla, Monica; Montgomery, Grant W.; Morley, Katherine I.; Mowat, Craig; Ng, Aylwin; Newman, William; Ophoff, Roel A.; Papi, Laura; Palmieri, Orazio; Peyrin-Biroulet, Laurent; Panes, Julian; Phillips, Anne; Prescott, Natalie J.; Proctor, Deborah D.; Roberts, Rebecca; Russell, Richard; Rutgeerts, Paul; Sanderson, Jeremy; Sans, Miquel; Schumm, Philip; Seibold, Frank; Sharma, Yashoda; Simms, Lisa A.; Seielstad, Mark; Steinhart, A. Hillary; Targan, Stephan R.; van den Berg, Leonard H.; Vatn, Morten; Verspaget, Hein; Walters, Thomas; Wijmenga, Cisca; Wilson, David C.; Westra, Harm-Jan; Xavier, Ramnik J.; Zhao, Zhen Z.; Ponsioen, Cyriel Y.; Andersen, Vibeke; Torkvist, Leif; Gazouli, Maria; Anagnou, Nicholas P.; Karlsen, Tom H.; Kupcinskas, Limas; Sventoraityte, Jurgita; Mansfield, John C.; Kugathasan, Subra; Silverberg, Mark S.; Halfvarson, Jonas; Rotter, Jerome I.; Mathew, Christopher G.; Griffiths, Anne M.; Gearry, Richard; Ahmad, Tariq; Brant, Steven R.; Chamaillard, Mathias; Satsangi, Jack; Cho, Judy H.; Schreiber, Stefan; Daly, Mark J.; Barrett, Jeffrey C.; Parkes, Miles; Annese, Vito; Hakonarson, Hakon; Radford-Smith, Graham; Duerr, Richard H.; Vermeire, Severine; Weersma, Rinse K.; Rioux, John D.",,,,NATURE GENETICS,Mar-11,2011,43,3,246,U94,,10.1038/ng.764,803,89.22,0,0,0,0,0,0,0,0,0,0,0,0,0,0,47,125,123,107,112,100,76
"OPA1, encoding a dynamin-related GTPase, is mutated in autosomal dominant optic atrophy linked to chromosome 3q28","Alexander, C; Votruba, M; Pesch, UEA; Thiselton, DL; Mayer, S; Moore, A; Rodriguez, M; Kellner, U; Leo-Kottler, B; Auburger, G; Bhattacharya, SS; Wissinger, B",,,,NATURE GENETICS,Oct-00,2000,26,2,211,215,,10.1038/79944,802,40.1,0,0,0,1,15,15,31,33,31,48,41,49,64,67,49,60,50,49,45,50,46
Genome-wide scan reveals association of psoriasis with IL-23 and NF-kappa B pathways,"Nair, Rajan P.; Duffin, Kristina Callis; Helms, Cynthia; Ding, Jun; Stuart, Philip E.; Goldgar, David; Gudjonsson, Johann E.; Li, Yun; Tejasvi, Trilokraj; Feng, Bing-Jian; Ruether, Andreas; Schreiber, Stefan; Weichenthal, Michael; Gladman, Dafna; Rahman, Proton; Schrodi, Steven J.; Prahalad, Sampath; Guthery, Stephen L.; Fischer, Judith; Liao, Wilson; Kwok, Pui-Yan; Menter, Alan; Lathrop, G. Mark; Awise, Carol; Begovich, Ann B.; Voorhees, John J.; Elder, James T.; Krueger, Gerald G.; Bowcock, Anne M.; Abecasis, Goncalo R.",Collaborative Assoc Study Psoriasi,,,NATURE GENETICS,Feb-09,2009,41,2,199,204,,10.1038/ng.311,801,72.82,0,0,0,0,0,0,0,0,0,0,0,0,37,82,104,101,81,92,88,61,56
Population genomics of human gene expression,"Stranger, Barbara E.; Nica, Alexandra C.; Forrest, Matthew S.; Dimas, Antigone; Bird, Christine P.; Beazley, Claude; Ingle, Catherine E.; Dunning, Mark; Flicek, Paul; Koller, Daphne; Montgomery, Stephen; Tavare, Simon; Deloukas, Panos; Dermitzakis, Emmanouil T.",,,,NATURE GENETICS,Oct-07,2007,39,10,1217,1224,,10.1038/ng2142,799,61.46,0,0,0,0,0,0,0,0,0,0,0,61,81,82,78,115,88,79,70,50,48
An Fgf8 mutant allelic series generated by Cre- and Flp-mediated recombination,"Meyers, EN; Lewandoski, M; Martin, GR",,,,NATURE GENETICS,Feb-98,1998,18,2,136,141,,10.1038/ng0298-136,796,36.18,0,20,49,63,57,43,48,56,50,58,42,42,36,46,37,23,24,31,22,21,12
UBE3A/E6-AP mutations cause Angelman syndrome,"Kishino, T; Lalande, M; Wagstaff, J",,,,NATURE GENETICS,Jan-97,1997,15,1,70,73,,10.1038/ng0197-70,795,34.57,31,63,44,36,34,25,25,27,40,18,22,29,25,39,41,41,32,38,43,39,44
The landscape of long noncoding RNAs in the human transcriptome,"Iyer, Matthew K.; Niknafs, Yashar S.; Malik, Rohit; Singhal, Udit; Sahu, Anirban; Hosono, Yasuyuki; Barrette, Terrence R.; Prensner, John R.; Evans, Joseph R.; Zhao, Shuang; Poliakov, Anton; Cao, Xuhong; Dhanasekaran, Saravana M.; Wu, Yi-Mi; Robinson, Dan R.; Beer, David G.; Feng, Felix Y.; Iyer, Hariharan K.; Chinnaiyan, Arul M.",,,,NATURE GENETICS,Mar-15,2015,47,3,199,+,,10.1038/ng.3192,794,158.8,0,0,0,0,0,0,0,0,0,0,0,0,0,0,0,0,0,0,43,153,206
Genome-wide analysis of Arabidopsis thaliana DNA methylation uncovers an interdependence between methylation and transcription,"Zilberman, Daniel; Gehring, Mary; Tran, Robert K.; Ballinger, Tracy; Henikoff, Steven",,,,NATURE GENETICS,Jan-07,2007,39,1,61,69,,10.1038/ng1929,794,61.08,0,0,0,0,0,0,0,0,0,0,44,53,63,86,90,70,72,61,62,60,56
Control sf endodermal endocrine development by Hes-1,"Jensen, J; Pedersen, EE; Galante, P; Hald, J; Heller, RS; Ishibashi, M; Kageyama, R; Guillemot, F; Serup, P; Madsen, OD",,,,NATURE GENETICS,Jan-00,2000,24,1,36,44,,,793,39.65,0,0,0,9,32,27,37,51,54,55,62,53,53,61,58,49,42,21,42,32,24
Disruption of the uncoupling protein-2 gene in mice reveals a role in immunity and reactive oxygen species production,"Arsenijevic, D; Onuma, H; Pecqueur, C; Raimbault, S; Manning, BS; Miroux, B; Couplan, E; Alves-Guerra, MC; Goubern, M; Surwit, R; Bouillaud, F; Richard, D; Collins, S; Ricquier, D",,,,NATURE GENETICS,Dec-00,2000,26,4,435,439,,10.1038/82565,792,39.6,0,0,0,1,35,56,58,49,56,55,42,40,50,45,45,32,40,39,34,31,37
Genome-wide analysis of mammalian promoter architecture and evolution,"Carninci, Piero; Sandelin, Albin; Lenhard, Boris; Katayama, Shintaro; Shimokawa, Kazuro; Ponjavic, Jasmina; Semple, Colin A. M.; Taylor, Martin S.; Engstrom, Par G.; Frith, Martin C.; Forrest, Alistair R. R.; Alkema, Wynand B.; Tan, Sin Lam; Plessy, Charles; Kodzius, Rimantas; Ravasi, Timothy; Kasukawa, Takeya; Fukuda, Shiro; Kanamori-Katayama, Mutsumi; Kitazume, Yayoi; Kawaji, Hideya; Kai, Chikatoshi; Nakamura, Mari; Konno, Hideaki; Nakano, Kenji; Mottagui-Tabar, Salim; Arner, Peter; Chesi, Alessandra; Gustincich, Stefano; Persichetti, Francesca; Suzuki, Harukazu; Grimmond, Sean M.; Wells, Christine A.; Orlando, Valerio; Wahlestedt, Claes; Liu, Edison T.; Harbers, Matthias; Kawai, Jun; Bajic, Vladimir B.; Hume, David A.; Hayashizaki, Yoshihide",,,,NATURE GENETICS,Jun-06,2006,38,6,626,635,,10.1038/ng1789,789,56.36,0,0,0,0,0,0,0,0,0,18,71,62,88,82,77,58,60,63,49,55,50
Genome-wide association analysis identifies 13 new risk loci for schizophrenia,"Ripke, Stephan; O'Dushlaine, Colm; Chambert, Kimberly; Moran, Jennifer L.; Kaehler, Anna K.; Akterin, Susanne; Bergen, Sarah E.; Collins, Ann L.; Crowley, James J.; Fromer, Menachem; Kim, Yunjung; Lee, Sang Hong; Magnusson, Patrik K. E.; Sanchez, Nick; Stahl, Eli A.; Williams, Stephanie; Wray, Naomi R.; Xia, Kai; Bettella, Francesco; Borglum, Anders D.; Bulik-Sullivan, Brendan K.; Cormican, Paul; Craddock, Nick; de Leeuw, Christiaan; Durmishi, Naser; Gill, Michael; Golimbet, Vera; Hamshere, Marian L.; Holmans, Peter; Hougaard, David M.; Kendler, Kenneth S.; Lin, Kuang; Morris, Derek W.; Mors, Ole; Mortensen, Preben B.; Neale, Benjamin M.; O'Neill, Francis A.; Owen, Michael J.; Milovancevic, Milica Pejovic; Posthuma, Danielle; Powell, John; Richards, Alexander L.; Riley, Brien P.; Ruderfer, Douglas; Rujescu, Dan; Sigurdsson, Engilbert; Silagadze, Teimuraz; Smit, August B.; Stefansson, Hreinn; Steinberg, Stacy; Suvisaari, Jaana; Tosato, Sarah; Verhage, Matthijs; Walters, James T.; Bramon, Elvira; Corvin, Aiden P.; O'Donovan, Michael C.; Stefansson, Kari; Scolnick, Edward; Purcell, Shaun; McCarroll, Steven A.; Sklar, Pamela; Hultman, Christina M.; Sullivan, Patrick F.",Multictr Genetic Studies Schizophr; Psychosis Endophenotypes Int Conso; Wellcome Trust Case Control Consor,,,NATURE GENETICS,Oct-13,2013,45,10,1150,+,,10.1038/ng.2742,787,112.43,0,0,0,0,0,0,0,0,0,0,0,0,0,0,0,0,7,135,189,164,135
A new logic for DNA engineering using recombination in Escherichia coli,"Zhang, YM; Buchholz, F; Muyrers, JPP; Stewart, AF",,,,NATURE GENETICS,Oct-98,1998,20,2,123,128,,10.1038/2417,787,35.77,0,0,11,25,25,39,29,29,34,30,35,47,47,49,56,63,38,54,53,40,26
Patterns of single-nucleotide polymorphisms in candidate genes for blood-pressure homeostasis,"Halushka, MK; Fan, JB; Bentley, K; Hsie, L; Shen, NP; Weder, A; Cooper, R; Lipshutz, R; Chakravarti, A",,,,NATURE GENETICS,Jul-99,1999,22,3,239,247,,,778,37.05,0,0,25,101,124,85,79,62,66,42,42,21,29,19,5,17,16,14,10,5,5
Genome-wide association study identifies common variants at four loci as genetic risk factors for Parkinson's disease,"Satake, Wataru; Nakabayashi, Yuko; Mizuta, Ikuko; Hirota, Yushi; Ito, Chiyomi; Kubo, Michiaki; Kawaguchi, Takahisa; Tsunoda, Tatsuhiko; Watanabe, Masahiko; Takeda, Atsushi; Tomiyama, Hiroyuki; Nakashima, Kenji; Hasegawa, Kazuko; Obata, Fumiya; Yoshikawa, Takeo; Kawakami, Hideshi; Sakoda, Saburo; Yamamoto, Mitsutoshi; Hattori, Nobutaka; Murata, Miho; Nakamura, Yusuke; Toda, Tatsushi",,,,NATURE GENETICS,Dec-09,2009,41,12,1303,U61,,10.1038/ng.485,777,70.64,0,0,0,0,0,0,0,0,0,0,0,0,2,59,104,111,88,82,85,76,72
Pendred syndrome is caused by mutations in a putative sulphate transporter gene (PDS),"Everett, LA; Glaser, B; Beck, JC; Idol, JR; Buchs, A; Heyman, M; Adawi, F; Hazani, E; Nassir, E; Baxevanis, AD; Sheffield, VC; Green, ED",,,,NATURE GENETICS,Dec-97,1997,17,4,411,422,,10.1038/ng1297-411,776,33.74,2,26,37,36,55,42,44,41,44,31,29,40,36,38,49,28,39,30,33,27,28
Epigenetic inactivation of SFRP genes allows constitutive WNT signaling in colorectal cancer,"Suzuki, H; Watkins, DN; Jair, KW; Schuebel, KE; Markowitz, SD; Chen, WD; Pretlow, TP; Bin Yang,; Akiyama, Y; van Engeland, M; Toyota, M; Tokino, T; Hinoda, Y; Imai, K; Herman, JG; Baylin, SB",,,,NATURE GENETICS,Apr-04,2004,36,4,417,422,,10.1038/ng1330,773,48.31,0,0,0,0,0,0,0,16,50,57,60,71,55,58,61,46,43,65,44,44,51
"AXIN1 mutations in hepatocellular carcinomas, and growth suppression in cancer cells by virus-mediated transfer of AXIN1","Satoh, S; Daigo, Y; Furukawa, Y; Kato, T; Miwa, N; Nishiwaki, T; Kawasoe, T; Ishiguro, H; Fujita, M; Tokino, T; Sasaki, Y; Imaoka, S; Murata, M; Shimano, T; Yamaoka, Y; Nakamura, Y",,,,NATURE GENETICS,Mar-00,2000,24,3,245,250,,10.1038/73448,772,38.6,0,0,0,20,95,99,56,63,39,32,42,33,40,21,48,24,27,20,28,33,23
"Mice lacking the vitamin D receptor exhibit impaired bone formation, uterine hypoplasia and growth retardation after weaning","Yoshizawa, T; Handa, Y; Uematsu, Y; Takeda, S; Sekine, K; Yoshihara, Y; Kawakami, T; Arioka, K; Sato, H; Uchiyama, Y; Masushige, S; Fukamizu, A; Matsumoto, T; Kato, S",,,,NATURE GENETICS,Aug-97,1997,16,4,391,396,,10.1038/ng0897-391,771,33.52,1,29,32,34,42,37,37,32,54,42,34,30,30,43,37,48,36,36,26,31,38
microRNA target predictions in animals,"Rajewsky, Nikolaus",,,,NATURE GENETICS,Jun-06,2006,38,,S8,S13,,10.1038/ng1798,770,55,0,0,0,0,0,0,0,0,0,16,66,87,71,69,78,59,68,66,53,32,43
Febrile seizures and generalized epilepsy associated with a mutation in the Na+-channel beta 1 subunit gene SCN1B,"Wallace, RH; Wang, DW; Singh, R; Scheffer, IE; George, AL; Phillips, HA; Saar, K; Reis, A; Johnson, EW; Sutherland, GR; Berkovic, SF; Mulley, JC",,,,NATURE GENETICS,Aug-98,1998,19,4,366,370,,,769,34.95,0,1,39,58,73,85,58,41,42,32,30,33,47,36,30,29,20,20,26,19,23
Variation in factor B (BF) and complement component 2 (C2) genes is associated with age-related macular degeneration,"Gold, B; Merriam, JE; Zernant, J; Hancox, LS; Taiber, AJ; Gehrs, K; Cramer, K; Neel, J; Bergeron, J; Barile, GR; Smith, RT; Dean, M; Allikmets, R",AMD Genetics Clin Study Grp,,,NATURE GENETICS,Apr-06,2006,38,4,458,462,,10.1038/ng1750,768,54.86,0,0,0,0,0,0,0,0,0,27,82,66,76,78,81,78,61,67,50,39,30
"Differential methylation of tissue- and cancer-specific CpG island shores distinguishes human induced pluripotent stem cells, embryonic stem cells and fibroblasts","Doi, Akiko; Park, In-Hyun; Wen, Bo; Murakami, Peter; Aryee, Martin J.; Irizarry, Rafael; Herb, Brian; Ladd-Acosta, Christine; Rho, Junsung; Loewer, Sabine; Miller, Justine; Schlaeger, Thorsten; Daley, George Q.; Feinberg, Andrew P.",,,,NATURE GENETICS,Dec-09,2009,41,12,1350,U123,,10.1038/ng.471,767,69.73,0,0,0,0,0,0,0,0,0,0,0,0,1,62,110,124,104,88,75,73,60
Polycomb-mediated methylation on Lys27 of histone H3 pre-marks genes for de novo methylation in cancer,"Schlesinger, Yeshayahu; Straussman, Ravid; Keshet, Ilana; Farkash, Shlomit; Hecht, Merav; Zimmerman, Joseph; Eden, Eran; Yakhini, Zohar; Ben-Shushan, Etti; Reubinoff, Benjamin E.; Bergman, Yehudit; Simon, Itamar; Cedar, Howard",,,,NATURE GENETICS,Feb-07,2007,39,2,232,236,,10.1038/ng1950,767,59,0,0,0,0,0,0,0,0,0,0,32,69,62,98,85,73,72,53,58,60,54
Gene-expression profile of the ageing brain in mice,"Lee, CK; Weindruch, R; Prolla, TA",,,,NATURE GENETICS,Jul-00,2000,25,3,294,297,,,767,38.35,0,0,0,6,63,75,61,71,62,36,49,39,29,45,29,37,32,24,33,17,25
Genome-wide association study meta-analysis identifies seven new rheumatoid arthritis risk loci,"Stahl, Eli A.; Raychaudhuri, Soumya; Remmers, Elaine F.; Xie, Gang; Eyre, Stephen; Thomson, Brian P.; Li, Yonghong; Kurreeman, Fina A. S.; Zhernakova, Alexandra; Hinks, Anne; Guiducci, Candace; Chen, Robert; Alfredsson, Lars; Amos, Christopher I.; Ardlie, Kristin G.; Barton, Anne; Bowes, John; Brouwer, Elisabeth; Burtt, Noel P.; Catanese, Joseph J.; Coblyn, Jonathan; Coenen, Marieke J. H.; Costenbader, Karen H.; Criswell, Lindsey A.; Crusius, J. Bart A.; Cui, Jing; de Bakker, Paul I. W.; De Jager, Philip L.; Ding, Bo; Emery, Paul; Flynn, Edward; Harrison, Pille; Hocking, Lynne J.; Huizinga, Tom W. J.; Kastner, Daniel L.; Ke, Xiayi; Lee, Annette T.; Liu, Xiangdong; Martin, Paul; Morgan, Ann W.; Padyukov, Leonid; Posthumus, Marcel D.; Radstake, Timothy R. D. J.; Reid, David M.; Seielstad, Mark; Seldin, Michael F.; Shadick, Nancy A.; Steer, Sophia; Tak, Paul P.; Thomson, Wendy; van der Helm-van Mil, Annette H. M.; van der Horst-Bruinsma, Irene E.; van der Schoot, C. Ellen; van Riel, Piet L. C. M.; Weinblatt, Michael E.; Wilson, Anthony G.; Wolbink, Gert Jan; Wordsworth, B. Paul; Wijmenga, Cisca; Karlson, Elizabeth W.; Toes, Rene E. M.; de Vries, Niek; Begovich, Ann B.; Worthington, Jane; Siminovitch, Katherine A.; Gregersen, Peter K.; Klareskog, Lars; Plenge, Robert M.",BIRAC Consortium; YEAR Consortium,,,NATURE GENETICS,Jun-10,2010,42,6,508,U56,,10.1038/ng.582,764,76.4,0,0,0,0,0,0,0,0,0,0,0,0,0,16,84,110,121,82,89,97,77
Genome-wide association study identifies eight loci associated with blood pressure,"Newton-Cheh, Christopher; Johnson, Toby; Gateva, Vesela; Tobin, Martin D.; Bochud, Murielle; Coin, Lachlan; Najjar, Samer S.; Zhao, Jing Hua; Heath, Simon C.; Eyheramendy, Susana; Papadakis, Konstantinos; Voight, Benjamin F.; Scott, Laura J.; Zhang, Feng; Farrall, Martin; Tanaka, Toshiko; Wallace, Chris; Chambers, John C.; Khaw, Kay-Tee; Nilsson, Peter; van der Harst, Pim; Polidoro, Silvia; Grobbee, Diederick E.; Onland-Moret, N. Charlotte; Bots, Michiel L.; Wain, Louise V.; Elliott, Katherine S.; Teumer, Alexander; Luan, Jian'an; Lucas, Gavin; Kuusisto, Johanna; Burton, Paul R.; Hadley, David; McArdle, Wendy L.; Brown, Morris; Dominiczak, Anna; Newhouse, Stephen J.; Samani, Nilesh J.; Webster, John; Zeggini, Eleftheria; Beckmann, Jacques S.; Bergmann, Sven; Lim, Noha; Song, Kijoung; Vollenweider, Peter; Waeber, Gerard; Waterworth, Dawn M.; Yuan, Xin; Groop, Leif; Orho-Melander, Marju; Allione, Alessandra; Di Gregorio, Alessandra; Guarrera, Simonetta; Panico, Salvatore; Ricceri, Fulvio; Romanazzi, Valeria; Sacerdote, Carlotta; Vineis, Paolo; Barroso, Ines; Sandhu, Manjinder S.; Luben, Robert N.; Crawford, Gabriel J.; Jousilahti, Pekka; Perola, Markus; Boehnke, Michael; Bonnycastle, Lori L.; Collins, Francis S.; Jackson, Anne U.; Mohlke, Karen L.; Stringham, Heather M.; Valle, Timo T.; Willer, Cristen J.; Bergman, Richard N.; Morken, Mario A.; Doering, Angela; Gieger, Christian; Illig, Thomas; Meitinger, Thomas; Org, Elin; Pfeufer, Arne; Wichmann, H. Erich; Kathiresan, Sekar; Marrugat, Jaume; O'Donnell, Christopher J.; Schwartz, Stephen M.; Siscovick, David S.; Subirana, Isaac; Freimer, Nelson B.; Hartikainen, Anna-Liisa; McCarthy, Mark I.; O'Reilly, Paul F.; Peltonen, Leena; Pouta, Anneli; de Jong, Paul E.; Snieder, Harold; van Gilst, Wiek H.; Clarke, Robert; Goel, Anuj; Hamsten, Anders; Peden, John F.; Seedorf, Udo; Syvanen, Ann-Christine; Tognoni, Giovanni; Lakatta, Edward G.; Sanna, Serena; Scheet, Paul; Schlessinger, David; Scuteri, Angelo; Doerr, Marcus; Ernst, Florian; Felix, Stephan B.; Homuth, Georg; Lorbeer, Roberto; Reffelmann, Thorsten; Rettig, Rainer; Voelker, Uwe; Galan, Pilar; Gut, Ivo G.; Hercberg, Serge; Lathrop, G. Mark; Zelenika, Diana; Deloukas, Panos; Soranzo, Nicole; Williams, Frances M.; Zhai, Guangju; Salomaa, Veikko; Laakso, Markku; Elosua, Roberto; Forouhi, Nita G.; Volzke, Henry; Uiterwaal, Cuno S.; van der Schouw, Yvonne T.; Numans, Mattijs E.; Matullo, Giuseppe; Navis, Gerjan; Berglund, Goran; Bingham, Sheila A.; Kooner, Jaspal S.; Connell, John M.; Bandinelli, Stefania; Ferrucci, Luigi; Watkins, Hugh; Spector, Tim D.; Tuomilehto, Jaakko; Altshuler, David; Strachan, David P.; Laan, Maris; Meneton, Pierre; Wareham, Nicholas J.; Uda, Manuela; Jarvelin, Marjo-Riitta; Mooser, Vincent; Melander, Olle; Loos, Ruth J. F.; Elliott, Paul; Abecasis, Goncalo R.; Caulfield, Mark; Munroe, Patricia B.",Wellcome Trust Case Control Consor,,,NATURE GENETICS,Jun-09,2009,41,6,666,676,,10.1038/ng.361,764,69.45,0,0,0,0,0,0,0,0,0,0,0,0,21,86,107,109,93,64,75,63,78
Collaborative genome-wide association analysis supports a role for ANK3 and CACNA1C in bipolar disorder,"Ferreira, Manuel A. R.; O'Donovan, Michael C.; Meng, Yan A.; Jones, Ian R.; Ruderfer, Douglas M.; Jones, Lisa; Fan, Jinbo; Kirov, George; Perlis, Roy H.; Green, Elaine K.; Smoller, Jordan W.; Grozeva, Detelina; Stone, Jennifer; Nikolov, Ivan; Chambert, Kimberly; Hamshere, Marian L.; Nimgaonkar, Vishwajit L.; Moskvina, Valentina; Thase, Michael E.; Caesar, Sian; Sachs, Gary S.; Franklin, Jennifer; Gordon-Smith, Katherine; Ardlie, Kristin G.; Gabriel, Stacey B.; Fraser, Christine; Blumenstiel, Brendan; Defelice, Matthew; Breen, Gerome; Gill, Michael; Morris, Derek W.; Elkin, Amanda; Muir, Walter J.; McGhee, Kevin A.; Williamson, Richard; MacIntyre, Donald J.; MacLean, Alan W.; Clair, David St; Robinson, Michelle; Van Beck, Margaret; Pereira, Ana C. P.; Kandaswamy, Radhika; McQuillin, Andrew; Collier, David A.; Bass, Nicholas J.; Young, Allan H.; Lawrence, Jacob; Ferrier, I. Nicol; Anjorin, Adebayo; Farmer, Anne; Curtis, David; Scolnick, Edward M.; McGuffin, Peter; Daly, Mark J.; Corvin, Aiden P.; Holmans, Peter A.; Blackwood, Douglas H.; Gurling, Hugh M.; Owen, Michael J.; Purcell, Shaun M.; Sklar, Pamela; Craddock, Nick",Wellcome Trust Case Control Consor,,,NATURE GENETICS,Sep-08,2008,40,9,1056,1058,,10.1038/ng.209,763,63.58,0,0,0,0,0,0,0,0,0,0,0,4,46,87,94,92,77,103,69,68,55
Systematic identification of trans eQTLs as putative drivers of known disease associations,"Westra, Harm-Jan; Peters, Marjolein J.; Esko, Tonu; Yaghootkar, Hanieh; Schurmann, Claudia; Kettunen, Johannes; Christiansen, Mark W.; Fairfax, Benjamin P.; Schramm, Katharina; Powell, Joseph E.; Zhernakova, Alexandra; Zhernakova, Daria V.; Veldink, Jan H.; Van den Berg, Leonard H.; Karjalainen, Juha; Withoff, Sebo; Uitterlinden, Andre G.; Hofman, Albert; Rivadeneira, Fernando; 't Hoen, Peter A. C.; Reinmaa, Eva; Fischer, Krista; Nelis, Mari; Milani, Lili; Melzer, David; Ferrucci, Luigi; Singleton, Andrew B.; Hernandez, Dena G.; Nalls, Michael A.; Homuth, Georg; Nauck, Matthias; Radke, Doerte; Voelker, Uwe; Perola, Markus; Salomaa, Veikko; Brody, Jennifer; Suchy-Dicey, Astrid; Gharib, Sina A.; Enquobahrie, Daniel A.; Lumley, Thomas; Montgomery, Grant W.; Makino, Seiko; Prokisch, Holger; Herder, Christian; Roden, Michael; Grallert, Harald; Meitinger, Thomas; Strauch, Konstantin; Li, Yang; Jansen, Ritsert C.; Visscher, Peter M.; Knight, Julian C.; Psaty, Bruce M.; Ripatti, Samuli; Teumer, Alexander; Frayling, Timothy M.; Metspalu, Andres; van Meurs, Joyce B. J.; Franke, Lude",,,,NATURE GENETICS,Oct-13,2013,45,10,1238,U195,,10.1038/ng.2756,762,108.86,0,0,0,0,0,0,0,0,0,0,0,0,0,0,0,0,3,70,130,157,184
"Alagille syndrome is caused by mutations in human Jagged1, which encodes a ligand for Notch1","Li, LH; Krantz, ID; Deng, Y; Genin, A; Banta, AB; Collins, CC; Qi, M; Trask, BJ; Kuo, WL; Cochran, J; Costa, T; Pierpont, MEM; Rand, EB; Piccoli, DA; Hood, L; Spinner, NB",,,,NATURE GENETICS,Jul-97,1997,16,3,243,251,,10.1038/ng0797-243,760,33.04,5,28,38,37,39,45,28,36,41,33,42,33,29,48,45,43,31,27,24,29,32
Induction of an interferon response by RNAi vectors in mammalian cells,"Bridge, AJ; Pebernard, S; Ducraux, A; Nicoulaz, AL; Iggo, R",,,,NATURE GENETICS,Jul-03,2003,34,3,263,264,,10.1038/ng1173,758,44.59,0,0,0,0,0,0,16,109,119,101,77,55,57,39,35,36,21,24,21,10,18
"DNMT1 binds HDAC2 and a new co-repressor, DMAP1, to form a complex at replication foci","Rountree, MR; Bachman, KE; Baylin, SB",,,,NATURE GENETICS,Jul-00,2000,25,3,269,277,,10.1038/77023,758,37.9,0,0,0,7,57,70,63,42,52,33,42,38,40,58,47,39,28,38,23,29,21
Peutz-Jeghers syndrome is caused by mutations in a novel serine threonine kinase,"Jenne, DE; Reimann, H; Nezu, J; Friedel, W; Loff, S; Jeschke, R; Muller, D; Back, W; Zimmer, M",,,,NATURE GENETICS,Jan-98,1998,18,1,38,44,,10.1038/ng0198-38,757,34.41,0,14,47,44,28,38,45,45,47,50,34,26,35,41,47,33,36,32,24,23,33
