Title,Authors,Corporate Authors,Editors,Book Editors,Source Title,Publication Date,Publication Year,Volume,Issue,Beginning Page,Ending Page,Article Number,DOI,Total Citations,Average per Year,1997,1998,1999,2000,2001,2002,2003,2004,2005,2006,2007,2008,2009,2010,2011,2012,2013,2014,2015,2016,2017
Loci influencing lipid levels and coronary heart disease risk in 16 European population cohorts,"Aulchenko, Yurii S.; Ripatti, Samuli; Lindqvist, Ida; Boomsma, Dorret; Heid, Iris M.; Pramstaller, Peter P.; Penninx, Brenda W. J. H.; Janssens, A. Cecile J. W.; Wilson, James F.; Spector, Tim; Martin, Nicholas G.; Pedersen, Nancy L.; Kyvik, Kirsten Ohm; Kaprio, Jaakko; Hofman, Albert; Freimer, Nelson B.; Jarvelin, Marjo-Riitta; Gyllensten, Ulf; Campbell, Harry; Rudan, Igor; Johansson, Asa; Marroni, Fabio; Hayward, Caroline; Vitart, Veronique; Jonasson, Inger; Pattaro, Cristian; Wright, Alan; Hastie, Nick; Pichler, Irene; Hicks, Andrew A.; Falchi, Mario; Willemsen, Gonneke; Hottenga, Jouke-Jan; de Geus, Eco J. C.; Montgomery, Grant W.; Whitfield, John; Magnusson, Patrik; Saharinen, Juha; Perola, Markus; Silander, Kaisa; Isaacs, Aaron; Sijbrands, Eric J. G.; Uitterlinden, Andre G.; Witteman, Jacqueline C. M.; Oostra, Ben A.; Elliott, Paul; Ruokonen, Aimo; Sabatti, Chiara; Gieger, Christian; Meitinger, Thomas; Kronenberg, Florian; Doering, Angela; Wichmann, H-Erich; Smit, Johannes H.; McCarthy, Mark I.; van Duijn, Cornelia M.; Peltonen, Leena",Engage Consortium,,,NATURE GENETICS,Jan-09,2009,41,1,47,55,,10.1038/ng.269,604,54.91,0,0,0,0,0,0,0,0,0,0,0,0,46,100,74,63,71,67,47,45,35
LINE-mediated retrotransposition of marked Alu sequences,"Dewannieux, M; Esnault, C; Heidmann, T",,,,NATURE GENETICS,Sep-03,2003,35,1,41,48,,10.1038/ng1223,604,35.53,0,0,0,0,0,0,5,38,52,43,37,39,34,31,39,46,36,36,34,34,47
A genome-wide association scan of tag SNPs identifies a susceptibility variant for colorectal cancer at 8q24.21,"Tomlinson, Ian; Webb, Emily; Carvajal-Carmona, Luis; Broderick, Peter; Kemp, Zoe; Spain, Sarah; Penegar, Steven; Chandler, Ian; Gorman, Maggie; Wood, Wendy; Barclay, Ella; Lubbe, Steven; Martin, Lynn; Sellick, Gabrielle; Jaeger, Emma; Hubner, Richard; Wild, Ruth; Rowan, Andrew; Fielding, Sarah; Howarth, Kimberley; Silver, Andrew; Atkin, Wendy; Muir, Kenneth; Logan, Richard; Kerr, David; Johnstone, Elaine; Sieber, Oliver; Gray, Richard; Thomas, Huw; Peto, Julian; Cazier, Baptiste; Houlston, Richard",CORGI Consortium,,,NATURE GENETICS,Aug-07,2007,39,8,984,988,,10.1038/ng2085,603,46.38,0,0,0,0,0,0,0,0,0,0,4,76,81,92,40,67,39,47,45,40,39
"Holt-Oram syndrome is caused by mutations in TBX5, a member of the Brachyury (T) gene family","Li, QY; NewburyEcob, RA; Terrett, JA; Wilson, DI; Curtis, ARJ; Yi, CH; Gebuhr, T; Bullen, PJ; Robson, SC; Strachan, T; Bonnet, D; Lyonnet, S; Young, ID; Raeburn, JA; Buckler, AJ; Law, DJ; Brook, JD",,,,NATURE GENETICS,Jan-97,1997,15,1,21,29,,,603,26.22,15,32,41,41,30,34,37,32,37,20,25,30,20,27,29,20,22,23,22,21,18
LD Score regression distinguishes confounding from polygenicity in genome-wide association studies,"Bulik-Sullivan, Brendan K.; Loh, Po-Ru; Finucane, Hilary K.; Ripke, Stephan; Yang, Jian; Patterson, Nick; Daly, Mark J.; Price, Alkes L.; Neale, Benjamin M.",Schizophrenia Working Grp,,,NATURE GENETICS,Mar-15,2015,47,3,291,+,,10.1038/ng.3211,602,120.4,0,0,0,0,0,0,0,0,0,0,0,0,0,0,0,0,0,0,22,78,134
Disruption of Cnp1 uncouples oligodendroglial functions in axonal support and myelination,"Lappe-Siefke, C; Goebbels, S; Gravel, M; Nicksch, E; Lee, J; Braun, PE; Griffiths, IR; Nave, KA",,,,NATURE GENETICS,Mar-03,2003,33,3,366,374,,10.1038/ng1095,601,35.35,0,0,0,0,0,0,12,15,30,35,38,37,43,40,38,43,41,44,40,39,42
Multiple newly identified loci associated with prostate cancer susceptibility,"Eeles, Rosalind A.; Kote-Jarai, Zsofia; Giles, Graham G.; Al Olama, Ali Amin; Guy, Michelle; Jugurnauth, Sarah K.; Mulholland, Shani; Leongamornlert, Daniel A.; Edwards, Stephen M.; Morrison, Jonathan; Field, Helen I.; Southey, Melissa C.; Severi, Gianluca; Donovan, Jenny L.; Hamdy, Freddie C.; Dearnaley, David P.; Muir, Kenneth R.; Smith, Charmaine; Bagnato, Melisa; Ardern-Jones, Audrey T.; Hall, Amanda L.; O'Brien, Lynne T.; Gehr-Swain, Beatrice N.; Wilkinson, Rosemary A.; Cox, Angie; Lewis, Sarah; Brown, Paul M.; Jhavar, Sameer G.; Tymrakiewicz, Malgorzata; Lophatananon, Artitaya; Bryant, Sarah L.; Horwich, Alan; Huddart, Robert A.; Khoo, Vincent S.; Parker, Christopher C.; Woodhouse, Christopher J.; Thompson, Alan; Christmas, Tim; Ogden, Chris; Fisher, Cyril; Jamieson, Charles; Cooper, Colin S.; English, Dallas R.; Hopper, John L.; Neal, David E.; Easton, Douglas F.",Uk Genetic Prostate Canc Study Col; British Assoc Urological Surg Sect; Uk ProtecT Study Collaborators,,,NATURE GENETICS,Mar-08,2008,40,3,316,321,,10.1038/ng.90,600,50,0,0,0,0,0,0,0,0,0,0,0,35,90,83,79,64,61,53,46,31,29
Intensely punctate meiotic recombination in the class II region of the major histocompatibility complex,"Jeffreys, AJ; Kauppi, L; Neumann, R",,,,NATURE GENETICS,Oct-01,2001,29,2,217,222,,10.1038/ng1001-217,600,31.58,0,0,0,0,6,60,98,82,63,49,36,26,22,22,28,20,22,17,6,12,14
Increased methylation variation in epigenetic domains across cancer types,"Hansen, Kasper Daniel; Timp, Winston; Bravo, Hector Corrada; Sabunciyan, Sarven; Langmead, Benjamin; McDonald, Oliver G.; Wen, Bo; Wu, Hao; Liu, Yun; Diep, Dinh; Briem, Eirikur; Zhang, Kun; Irizarry, Rafael A.; Feinberg, Andrew P.",,,,NATURE GENETICS,Aug-11,2011,43,8,768,U77,,10.1038/ng.865,599,66.56,0,0,0,0,0,0,0,0,0,0,0,0,0,0,4,63,95,111,92,79,68
Cyclin-dependent kinase 2 is essential for meiosis but not for mitotic cell division in mice,"Ortega, S; Prieto, I; Odajima, J; Martin, A; Dubus, P; Sotillo, R; Barbero, JL; Malumbres, M; Barbacid, M",,,,NATURE GENETICS,Sep-03,2003,35,1,25,31,,10.1038/ng1232,599,35.24,0,0,0,0,0,0,9,74,73,60,42,43,39,45,31,42,26,18,21,22,23
Telomere maintenance by recombination in human cells,"Dunham, MA; Neumann, AA; Fasching, CL; Reddel, RR",,,,NATURE GENETICS,Dec-00,2000,26,4,447,450,,10.1038/82586,599,29.95,0,0,0,1,31,49,43,50,46,31,29,25,46,36,27,29,30,30,18,18,25
A breakpoint map of recurrent chromosomal rearrangements in human neoplasia,"Mitelman, F; Mertens, F; Johansson, B",,,,NATURE GENETICS,Apr-97,1997,15,,417,474,,10.1038/ng0497supp-417,598,26,16,56,87,87,72,55,42,35,27,17,16,19,14,9,9,5,7,5,7,2,4
A high- resolution atlas of nucleosome occupancy in yeast,"Lee, William; Tillo, Desiree; Bray, Nicolas; Morse, Randall H.; Davis, Ronald W.; Hughes, Timothy R.; Nislow, Corey",,,,NATURE GENETICS,Oct-07,2007,39,10,1235,1244,,10.1038/ng2117,596,45.85,0,0,0,0,0,0,0,0,0,0,1,40,92,95,83,64,44,62,34,31,21
Analysis of immune-related loci identifies 48 new susceptibility variants for multiple sclerosis,"Beecham, Ashley H.; Patsopoulos, Nikolaos A.; Xifara, Dionysia K.; Davis, Mary F.; Kemppinen, Anu; Cotsapas, Chris; Shah, Tejas S.; Spencer, Chris; Booth, David; Goris, An; Oturai, Annette; Saarela, Janna; Fontaine, Bertrand; Hemmer, Bernhard; Martin, Claes; Zipp, Frauke; D'Alfonso, Sandra; Martinelli-Boneschi, Filippo; Taylor, Bruce; Harbo, Hanne F.; Kockum, Ingrid; Hillert, Jan; Olsson, Tomas; Ban, Maria; Oksenberg, Jorge R.; Hintzen, Rogier; Barcellos, Lisa F.; Agliardi, Cristina; Alfredsson, Lars; Alizadeh, Mehdi; Anderson, Carl; Andrews, Robert; Sondergaard, Helle Bach; Baker, Amie; Band, Gavin; Baranzini, Sergio E.; Barizzone, Nadia; Barrett, Jeffrey; Bellenguez, Celine; Bergamaschi, Laura; Bernardinelli, Luisa; Berthele, Achim; Biberacher, Viola; Binder, Thomas M. C.; Blackburn, Hannah; Bomfim, Izaura L.; Brambilla, Paola; Broadley, Simon; Brochet, Bruno; Brundin, Lou; Buck, Dorothea; Butzkueven, Helmut; Caillier, Stacy J.; Camu, William; Carpentier, Wassila; Cavalla, Paola; Celius, Elisabeth G.; Coman, Irene; Comi, Giancarlo; Corrado, Lucia; Cosemans, Leentje; Cournu-Rebeix, Isabelle; Cree, Bruce A. C.; Cusi, Daniele; Damotte, Vincent; Defer, Gilles; Delgado, Silvia R.; Deloukas, Panos; di Sapio, Alessia; Dilthey, Alexander T.; Donnelly, Peter; Dubois, Benedicte; Duddy, Martin; Edkins, Sarah; Elovaara, Irina; Esposito, Federica; Evangelou, Nikos; Fiddes, Barnaby; Field, Judith; Franke, Andre; Freeman, Colin; Frohlich, Irene Y.; Galimberti, Daniela; Gieger, Christian; Gourraud, Pierre-Antoine; Graetz, Christiane; Graham, Andrew; Grummel, Verena; Guaschino, Clara; Hadjixenofontos, Athena; Hakonarson, Hakon; Halfpenny, Christopher; Hall, Gillian; Hall, Per; Hamsten, Anders; Harley, James; Harrower, Timothy; Hawkins, Clive; Hellenthal, Garrett; Hillier, Charles; Hobart, Jeremy; Hoshi, Muni; Hunt, Sarah E.; Jagodic, Maja; Jelcic, Ilijas; Jochim, Angela; Kendall, Brian; Kermode, Allan; Kilpatrick, Trevor; Koivisto, Keijo; Konidari, Ioanna; Korn, Thomas; Kronsbein, Helena; Langford, Cordelia; Larsson, Malin; Lathrop, Mark; Lebrun-Frenay, Christine; Lechner-Scott, Jeannette; Lee, Michelle H.; Leone, Maurizio A.; Leppa, Virpi; Liberatore, Giuseppe; Lie, Benedicte A.; Lill, Christina M.; Linden, Magdalena; Link, Jenny; Luessi, Felix; Lycke, Jan; Macciardi, Fabio; Mannisto, Satu; Manrique, Clara P.; Martin, Roland; Martinelli, Vittorio; Mason, Deborah; Mazibrada, Gordon; McCabe, Cristin; Mero, Inger-Lise; Mescheriakova, Julia; Moutsianas, Loukas; Myhr, Kjell-Morten; Nagels, Guy; Nicholas, Richard; Nilsson, Petra; Piehl, Fredrik; Pirinen, Matti; Price, Sian E.; Quach, Hong; Reunanen, Mauri; Robberecht, Wim; Robertson, Neil P.; Rodegher, Mariaemma; Rog, David; Salvetti, Marco; Schnetz-Boutaud, Nathalie C.; Sellebjerg, Finn; Selter, Rebecca C.; Schaefer, Catherine; Shaunak, Sandip; Shen, Ling; Shields, Simon; Siffrin, Volker; Slee, Mark; Sorensen, Per Soelberg; Sorosina, Melissa; Sospedra, Mireia; Spurkland, Anne; Strange, Amy; Sundqvist, Emilie; Thijs, Vincent; Thorpe, John; Ticca, Anna; Tienari, Pentti; van Duijn, Cornelia; Visser, Elizabeth M.; Vucic, Steve; Westerlind, Helga; Wiley, James S.; Wilkins, Alastair; Wilson, James F.; Winkelmann, Juliane; Zajicek, John; Zindler, Eva; Haines, Jonathan L.; Pericak-Vance, Margaret A.; Ivinson, Adrian J.; Stewart, Graeme; Hafler, David; Hauser, Stephen L.; Compston, Alastair; McVean, Gil; De Jager, Philip; Sawcer, Stephen J.; McCauley, Jacob L.",Wellcome Trust Case Control Consor; Int IBD Genetics Consortium IIBDGC,,,NATURE GENETICS,Nov-13,2013,45,11,1353,+,,10.1038/ng.2770,595,85,0,0,0,0,0,0,0,0,0,0,0,0,0,0,0,0,2,81,142,120,107
Extensive and coordinated transcription of noncoding RNAs within cell-cycle promoters,"Hung, Tiffany; Wang, Yulei; Lin, Michael F.; Koegel, Ashley K.; Kotake, Yojiro; Grant, Gavin D.; Horlings, Hugo M.; Shah, Nilay; Umbricht, Christopher; Wang, Pei; Wang, Yu; Kong, Benjamin; Langerod, Anita; Borresen-Dale, Anne-Lise; Kim, Seung K.; van de Vijver, Marc; Sukumar, Saraswati; Whitfield, Michael L.; Kellis, Manolis; Xiong, Yue; Wong, David J.; Chang, Howard Y.",,,,NATURE GENETICS,Jul-11,2011,43,7,621,U196,,10.1038/ng.848,595,66.11,0,0,0,0,0,0,0,0,0,0,0,0,0,0,4,35,65,78,76,116,101
A recurrent mutation in the BMP type I receptor ACVR1 causes inherited and sporadic fibrodysplasia ossificans progressiva,"Shore, EM; Xu, MQ; Feldman, GJ; Fenstermacher, DA; Brown, MA; Kaplan, FS",FOP Int Res Consortium,,,NATURE GENETICS,May-06,2006,38,5,525,527,,10.1038/ng1783,595,42.5,0,0,0,0,0,0,0,0,0,5,27,35,41,44,44,55,34,47,53,59,43
Polymorphisms in FKBP5 are associated with increased recurrence of depressive episodes and rapid response to antidepressant treatment,"Binder, EB; Salyakina, D; Lichtner, P; Wochnik, GM; Ising, M; Putz, B; Papiol, S; Seaman, S; Lucae, S; Kohli, MA; Nickel, T; Kunzel, HE; Fuchs, B; Majer, M; Pfennig, A; Kern, N; Brunner, J; Modell, S; Baghai, T; Deiml, T; Zill, P; Bondy, B; Rupprecht, R; Messer, T; Kohnlein, O; Dabitz, H; Bruckl, T; Muller, N; Pfister, H; Lieb, R; Mueller, JC; Lohmussaar, E; Strom, TM; Bettecken, T; Meitinger, T; Uhr, M; Rein, T; Holsboer, F; Muller-Myhsok, B",,,,NATURE GENETICS,Dec-04,2004,36,12,1319,1325,,10.1038/ng1479,595,37.19,0,0,0,0,0,0,0,1,13,27,28,39,45,42,59,46,42,52,42,51,42
Nrl is required for rod photoreceptor development,"Mears, AJ; Kondo, M; Swain, PK; Takada, Y; Bush, RA; Saunders, TL; Sieving, PA; Swaroop, A",,,,NATURE GENETICS,Dec-01,2001,29,4,447,452,,10.1038/ng774,595,31.32,0,0,0,0,0,13,18,34,34,35,40,36,27,53,37,32,32,42,39,44,34
Genome-wide association study in a Chinese Han population identifies nine new susceptibility loci for systemic lupus erythematosus,"Han, Jian-Wen; Zheng, Hou-Feng; Cui, Yong; Sun, Liang-Dan; Ye, Dong-Qing; Hu, Zhi; Xu, Jin-Hua; Cai, Zhi-Ming; Huang, Wei; Zhao, Guo-Ping; Xie, Hong-Fu; Fang, Hong; Lu, Qian-Jin; Xu, Jian-Hua; Li, Xiang-Pei; Pan, Yun-Feng; Deng, Dan-Qi; Zeng, Fan-Qin; Ye, Zhi-Zhong; Zhang, Xiao-Yan; Wang, Qing-Wen; Hao, Fei; Ma, Li; Zuo, Xian-Bo; Zhou, Fu-Sheng; Du, Wen-Hui; Cheng, Yi-Lin; Yang, Jian-Qiang; Shen, Song-Ke; Li, Jian; Sheng, Yu-Jun; Zuo, Xiao-Xia; Zhu, Wei-Fang; Gao, Fei; Zhang, Pei-Lian; Guo, Qing; Li, Bo; Gao, Min; Xiao, Feng-Li; Quan, Cheng; Zhang, Chi; Zhang, Zheng; Zhu, Kun-Ju; Li, Yang; Hu, Da-Yan; Lu, Wen-Sheng; Huang, Jian-Lin; Liu, Sheng-Xiu; Li, Hui; Ren, Yun-Qing; Wang, Zai-Xing; Yang, Chun-Jun; Wang, Pei-Guang; Zhou, Wen-Ming; Lv, Yong-Mei; Zhang, An-Ping; Zhang, Sheng-Quan; Lin, Da; Li, Yi; Low, Hui Qi; Shen, Min; Zhai, Zhi-Fang; Wang, Ying; Zhang, Feng-Yu; Yang, Sen; Liu, Jian-Jun; Zhang, Xue-Jun",,,,NATURE GENETICS,Nov-09,2009,41,11,1234,U98,,10.1038/ng.472,594,54,0,0,0,0,0,0,0,0,0,0,0,0,0,32,73,77,84,53,69,59,64
Recombinational DNA double-strand breaks in mice precede synapsis,"Mahadevaiah, SK; Turner, JMA; Baudat, F; Rogakou, EP; de Boer, P; Blanco-Rodriguez, J; Jasin, M; Keeney, S; Bonner, WM; Burgoyne, PS",,,,NATURE GENETICS,Mar-01,2001,27,3,271,276,,10.1038/85830,594,31.26,0,0,0,0,10,21,46,46,46,34,48,24,39,36,41,25,31,29,25,29,26
Mutation in hepatocyte nuclear factor-1 beta gene (TCF2) associated with MODY,"Horikawa, Y; Iwasaki, N; Hara, M; Furuta, H; Hinokio, Y; Cockburn, BN; Lindner, T; Yamagata, K; Ogata, M; Tomonaga, O; Kuroki, H; Kasahara, T; Iwamoto, Y; Bell, GI",,,,NATURE GENETICS,Dec-97,1997,17,4,384,385,,10.1038/ng1297-384,593,25.78,0,19,38,52,55,44,25,30,26,23,31,23,27,24,19,20,19,24,26,13,26
Integrative genome analyses identify key somatic driver mutations of small-cell lung cancer,"Peifer, Martin; Fernandez-Cuesta, Lynnette; Sos, Martin L.; George, Julie; Seidel, Danila; Kasper, Lawryn H.; Plenker, Dennis; Leenders, Frauke; Sun, Ruping; Zander, Thomas; Menon, Roopika; Koker, Mirjam; Dahmen, Ilona; Mueller, Christian; Di Cerbo, Vincenzo; Schildhaus, Hans-Ulrich; Altmueller, Janine; Baessmann, Ingelore; Becker, Christian; de Wilde, Bram; Vandesompele, Jo; Boehm, Diana; Ansen, Sascha; Gabler, Franziska; Wilkening, Ines; Heynck, Stefanie; Heuckmann, Johannes M.; Lu, Xin; Carter, Scott L.; Cibulskis, Kristian; Banerji, Shantanu; Getz, Gad; Park, Kwon-Sik; Rauh, Daniel; Gruetter, Christian; Fischer, Matthias; Pasqualucci, Laura; Wright, Gavin; Wainer, Zoe; Russell, Prudence; Petersen, Iver; Chen, Yuan; Stoelben, Erich; Ludwig, Corinna; Schnabel, Philipp; Hoffmann, Hans; Muley, Thomas; Brockmann, Michael; Engel-Riedel, Walburga; Muscarella, Lucia A.; Fazio, Vito M.; Groen, Harry; Timens, Wim; Sietsma, Hannie; Thunnissen, Erik; Smit, Egbert; Heideman, Danielle A. M.; Snijders, Peter J. F.; Cappuzzo, Federico; Ligorio, Claudia; Damiani, Stefania; Field, John; Solberg, Steinar; Brustugun, Odd Terje; Lund-Iversen, Marius; Saenger, Joerg; Clement, Joachim H.; Soltermann, Alex; Moch, Holger; Weder, Walter; Solomon, Benjamin; Soria, Jean-Charles; Validire, Pierre; Besse, Benjamin; Brambilla, Elisabeth; Brambilla, Christian; Lantuejoul, Sylvie; Lorimier, Philippe; Schneider, Peter M.; Hallek, Michael; Pao, William; Meyerson, Matthew; Sage, Julien; Shendure, Jay; Schneider, Robert; Buettner, Reinhard; Wolf, Juergen; Nuernberg, Peter; Perner, Sven; Heukamp, Lukas C.; Brindle, Paul K.; Haas, Stefan; Thomas, Roman K.",,,,NATURE GENETICS,Oct-12,2012,44,10,1104,+,,10.1038/ng.2396,591,73.88,0,0,0,0,0,0,0,0,0,0,0,0,0,0,0,2,62,91,99,104,96
Activation of the AXL kinase causes resistance to EGFR-targeted therapy in lung cancer,"Zhang, Zhenfeng; Lee, Jae Cheol; Lin, Luping; Olivas, Victor; Au, Valerie; LaFramboise, Thomas; Abdel-Rahman, Mohamed; Wang, Xiaoqi; Levine, Alan D.; Rho, Jin Kyung; Choi, Yun Jung; Choi, Chang-Min; Kim, Sang-We; Jang, Se Jin; Park, Young Soo; Kim, Woo Sung; Lee, Dae Ho; Lee, Jung-Shin; Miller, Vincent A.; Arcila, Maria; Ladanyi, Marc; Moonsamy, Philicia; Sawyers, Charles; Boggon, Titus J.; Ma, Patrick C.; Costa, Carlota; Taron, Miquel; Rosell, Rafael; Halmos, Balazs; Bivona, Trever G.",,,,NATURE GENETICS,Aug-12,2012,44,8,852,+,,10.1038/ng.2330,591,73.88,0,0,0,0,0,0,0,0,0,0,0,0,0,0,0,3,65,87,97,105,106
The Genetic Association Database,"Becker, KG; Barnes, KC; Bright, TJ; Wang, SA",,,,NATURE GENETICS,May-04,2004,36,5,431,432,,10.1038/ng0504-431,588,36.75,0,0,0,0,0,0,0,6,8,12,20,18,41,36,39,43,50,65,83,54,48
Exome sequencing identifies recurrent somatic RAC1 mutations in melanoma,"Krauthammer, Michael; Kong, Yong; Ha, Byung Hak; Evans, Perry; Bacchiocchi, Antonella; McCusker, James P.; Cheng, Elaine; Davis, Matthew J.; Goh, Gerald; Choi, Murim; Ariyan, Stephan; Narayan, Deepak; Dutton-Regester, Ken; Capatana, Ana; Holman, Edna C.; Bosenberg, Marcus; Sznol, Mario; Kluger, Harriet M.; Brash, Douglas E.; Stern, David F.; Materin, Miguel A.; Lo, Roger S.; Mane, Shrikant; Ma, Shuangge; Kidd, Kenneth K.; Hayward, Nicholas K.; Lifton, Richard P.; Schlessinger, Joseph; Boggon, Titus J.; Halaban, Ruth",,,,NATURE GENETICS,Sep-12,2012,44,9,1006,+,,10.1038/ng.2359,587,73.38,0,0,0,0,0,0,0,0,0,0,0,0,0,0,0,10,82,98,94,109,91
Integrative molecular concept modeling of prostate cancer progression,"Tomlins, Scott A.; Mehra, Rohit; Rhodes, Daniel R.; Cao, Xuhong; Wang, Lei; Dhanasekaran, Saravana M.; Kalyana-Sundaram, Shanker; Wei, John T.; Rubin, Mark A.; Pienta, Kenneth J.; Shah, Rajal B.; Chinnaiyan, Arul M.",,,,NATURE GENETICS,Jan-07,2007,39,1,41,51,,10.1038/ng1935,586,45.08,0,0,0,0,0,0,0,0,0,0,21,61,57,45,44,58,48,42,60,46,45
An atlas of genetic correlations across human diseases and traits,"Bulik-Sullivan, Brendan; Finucane, Hilary K.; Anttila, Verneri; Gusev, Alexander; Day, Felix R.; Loh, Po-Ru; Duncan, Laramie; Perry, John R. B.; Patterson, Nick; Robinson, Elise B.; Daly, Mark J.; Price, Alkes L.; Neale, Benjamin M.",ReproGen Consortium; Psychiat Genomics Consortium; Genetic Consortium Anorexia Nervos,,,NATURE GENETICS,Nov-15,2015,47,11,1236,+,,10.1038/ng.3406,585,117,0,0,0,0,0,0,0,0,0,0,0,0,0,0,0,0,0,0,9,76,159
A rice quantitative trait locus for salt tolerance encodes a sodium transporter,"Ren, ZH; Gao, JP; Li, LG; Cai, XL; Huang, W; Chao, DY; Zhu, MZ; Wang, ZY; Luan, S; Lin, HX",,,,NATURE GENETICS,Oct-05,2005,37,10,1141,1146,,10.1038/ng1643,585,39,0,0,0,0,0,0,0,0,2,18,41,36,32,36,42,36,39,47,48,48,53
A complementary transposon tool kit for Drosophila melanogaster using P and piggyBac,"Thibault, ST; Singer, MA; Miyazaki, WY; Milash, B; Dompe, NA; Singh, CM; Buchholz, R; Demsky, M; Fawcett, R; Francis-Lang, HL; Ryner, L; Cheung, LM; Chong, A; Erickson, C; Fisher, WW; Greer, K; Hartouni, SR; Howie, E; Jakkula, L; Joo, D; Killpack, K; Laufer, A; Mazzotta, J; Smith, RD; Stevens, LM; Stuber, C; Tan, LR; Ventura, R; Woo, A; Zakrajsek, I; Zhao, L; Chen, F; Swimmer, C; Kopczynski, C; Duyk, G; Winberg, ML; Margolis, J",,,,NATURE GENETICS,Mar-04,2004,36,3,283,287,,10.1038/ng1314,585,36.56,0,0,0,0,0,0,0,11,26,30,52,43,54,53,53,55,39,42,39,24,29
Functional SNPs in the lymphotoxin-alpha gene that are associated with susceptibility to myocardial infarction,"Ozaki, K; Ohnishi, Y; Iida, A; Sekine, A; Yamada, R; Tsunoda, T; Sato, H; Sato, H; Hori, M; Nakamura, Y; Tanaka, T",,,,NATURE GENETICS,Dec-02,2002,32,4,650,654,,10.1038/ng1047,585,32.5,0,0,0,0,0,0,32,54,73,63,76,62,49,32,30,22,25,13,14,13,8
Regulation of the Caenorhabditis elegans longevity protein DAF-16 by insulin/IGF-1 and germline signaling,"Lin, K; Hsin, H; Libina, N; Kenyon, C",,,,NATURE GENETICS,Jun-01,2001,28,2,139,145,,10.1038/88850,585,30.79,0,0,0,0,8,20,23,20,26,34,34,38,30,33,39,39,53,34,35,31,47
Obesity resistance and multiple mechanisms of triglyceride synthesis in mice lacking Dgat,"Smith, SJ; Cases, S; Jensen, DR; Chen, HC; Sande, E; Tow, B; Sanan, DA; Raber, J; Eckel, RH; Farese, RV",,,,NATURE GENETICS,May-00,2000,25,1,87,90,,10.1038/75651,585,29.25,0,0,0,5,19,30,25,41,28,30,34,29,34,38,44,38,30,35,30,25,28
Loss-of-function mutations in the gene encoding filaggrin cause ichthyosis vulgaris,"Smith, FJD; Irvine, AD; Terron-Kwiatkowski, A; Sandilands, A; Campbell, LE; Zhao, YW; Liao, HH; Evans, AT; Goudie, DR; Lewis-Jones, S; Arseculeratne, G; Munro, CS; Sergeant, A; O'Regan, G; Bale, SJ; Compton, JG; DiGiovanna, JJ; Presland, RB; Fleckman, P; McLean, WHI",,,,NATURE GENETICS,Mar-06,2006,38,3,337,342,,10.1038/ng1743,584,41.71,0,0,0,0,0,0,0,0,0,16,43,54,64,54,63,45,45,43,38,45,31
Pseudoautosomal deletions encompassing a novel homeobox gene cause growth failure in idiopathic short stature and Turner syndrome,"Rao, E; Weiss, B; Fukami, M; Rump, A; Niesler, B; Mertz, A; Muroya, K; Binder, G; Kirsch, S; Winkelmann, M; Nordsiek, G; Heinrich, U; Breuning, MH; Ranke, MB; Rosenthal, A; Ogata, T; Rappold, GA",,,,NATURE GENETICS,May-97,1997,16,1,54,63,,10.1038/ng0597-54,583,25.35,10,26,26,41,37,34,34,28,23,23,31,26,26,28,27,24,25,22,22,25,14
HLA-B(star)5701 genotype is a major determinant of drug-induced liver injury due to flucloxacillin,"Daly, Ann K.; Donaldson, Peter T.; Bhatnagar, Pallav; Shen, Yufeng; Pe'er, Itsik; Floratos, Aris; Daly, Mark J.; Goldstein, David B.; John, Sally; Nelson, Matthew R.; Graham, Julia; Park, B. Kevin; Dillon, John F.; Bernal, William; Cordell, Heather J.; Pirmohamed, Munir; Aithal, Guruprasad P.; Day, Christopher P.",DILIGEN Study; Int SAE Consortium,,,NATURE GENETICS,Jul-09,2009,41,7,816,U71,,10.1038/ng.379,582,52.91,0,0,0,0,0,0,0,0,0,0,0,0,9,62,68,72,69,58,64,46,71
A signature of chromosomal instability inferred from gene expression profiles predicts clinical outcome in multiple human cancers,"Carter, Scott L.; Eklund, Aron C.; Kohane, Isaac S.; Harris, Lyndsay N.; Szallasi, Zoltan",,,,NATURE GENETICS,Sep-06,2006,38,9,1043,1048,,10.1038/ng1861,582,41.57,0,0,0,0,0,0,0,0,0,1,22,34,35,46,46,43,62,52,51,58,55
Huntingtin interacts with REST/NRSF to modulate the transcription of NRSE-controlled neuronal genes,"Zuccato, C; Tartari, M; Crotti, A; Goffredo, D; Valenza, M; Conti, L; Cataudella, T; Leavitt, BR; Hayden, MR; Timmusk, T; Rigamonti, D; Cattaneo, E",,,,NATURE GENETICS,Sep-03,2003,35,1,76,83,,10.1038/ng1219,582,34.24,0,0,0,0,0,0,3,27,32,46,37,45,37,42,45,47,41,40,44,25,37
Mutations in RAB27A cause Griscelli syndrome associated with haemophagocytic syndrome,"Menasche, G; Pastural, E; Feldmann, J; Certain, S; Ersoy, F; Dupuis, S; Wulffraat, N; Bianchi, D; Fischer, A; Le Deist, F; de Saint Basile, G",,,,NATURE GENETICS,Jun-00,2000,25,2,173,176,,10.1038/76024,582,29.1,0,0,0,4,26,53,34,34,29,34,38,38,33,27,29,30,39,27,28,22,23
The BCL-6 proto-oncogene controls germinal-centre formation and Th2-type inflammation,"Ye, BH; Cattoretti, G; Shen, QO; Zhang, JD; Hawe, N; deWaard, R; Leung, C; NouriShirazi, M; Orazi, A; Chaganti, RSK; Rothman, P; Stall, AM; Pandolfi, PP; DallaFavera, R",,,,NATURE GENETICS,Jun-97,1997,16,2,161,170,,10.1038/ng0697-161,582,25.3,2,25,29,36,28,46,27,22,36,29,31,25,25,28,29,39,18,32,15,20,12
Essential role of Plzf in maintenance of spermatogonial stem cells,"Costoya, JA; Hobbs, RM; Barna, M; Cattoretti, G; Manova, K; Sukhwani, M; Orwig, KE; Wolgemuth, DJ; Pandolfi, PP",,,,NATURE GENETICS,Jun-04,2004,36,6,653,659,,10.1038/ng1367,581,36.31,0,0,0,0,0,0,0,5,13,30,29,36,41,45,31,43,50,43,52,50,51
Variation is the spice of life,"Kruglyak, L; Nickerson, DA",,,,NATURE GENETICS,Mar-01,2001,27,3,234,236,,10.1038/85776,580,30.53,0,0,0,0,9,30,28,52,72,58,66,53,47,36,25,25,18,20,14,9,9
Analysis of human transcriptomes,"Velculescu, VE; Madden, SL; Zhang, L; Lash, AE; Yu, J; Rago, C; Lal, A; Wang, CJ; Beaudry, GA; Ciriello, KM; Cook, BP; Dufault, MR; Ferguson, AT; Gao, YH; He, TC; Hermeking, H; Hiraldo, SK; Hwang, PM; Lopez, MA; Luderer, HF; Mathews, B; Petroziello, JM; Polyak, K; Zawel, L; Zhang, W; Zhang, XM; Zhou, W; Haluska, FG; Jen, J; Sukumar, S; Landes, GM; Riggins, GJ; Vogelstein, B; Kinzler, KW",,,,NATURE GENETICS,Dec-99,1999,23,4,387,388,,10.1038/70487,580,27.62,0,0,1,33,55,43,45,45,48,45,35,35,36,18,21,24,24,15,17,19,8
