Title,Authors,Corporate Authors,Editors,Book Editors,Source Title,Publication Date,Publication Year,Volume,Issue,Beginning Page,Ending Page,Article Number,DOI,Total Citations,Average per Year,1997,1998,1999,2000,2001,2002,2003,2004,2005,2006,2007,2008,2009,2010,2011,2012,2013,2014,2015,2016,2017
Gene Ontology: tool for the unification of biology,"Ashburner, M; Ball, CA; Blake, JA; Botstein, D; Butler, H; Cherry, JM; Davis, AP; Dolinski, K; Dwight, SS; Eppig, JT; Harris, MA; Hill, DP; Issel-Tarver, L; Kasarskis, A; Lewis, S; Matese, JC; Richardson, JE; Ringwald, M; Rubin, GM; Sherlock, G",Gene Ontology Consortium,,,NATURE GENETICS,May-00,2000,25,1,25,29,,10.1038/75556,17451,872.55,0,0,0,13,62,147,251,397,540,629,737,871,999,1120,1151,1209,1295,1406,1471,1391,1471
Principal components analysis corrects for stratification in genome-wide association studies,"Price, Alkes L.; Patterson, Nick J.; Plenge, Robert M.; Weinblatt, Michael E.; Shadick, Nancy A.; Reich, David",,,,NATURE GENETICS,Aug-06,2006,38,8,904,909,,10.1038/ng1847,4954,353.86,0,0,0,0,0,0,0,0,0,5,58,137,259,368,416,484,463,498,524,482,506
A framework for variation discovery and genotyping using next-generation DNA sequencing data,"DePristo, Mark A.; Banks, Eric; Poplin, Ryan; Garimella, Kiran V.; Maguire, Jared R.; Hartl, Christopher; Philippakis, Anthony A.; del Angel, Guillermo; Rivas, Manuel A.; Hanna, Matt; McKenna, Aaron; Fennell, Tim J.; Kernytsky, Andrew M.; Sivachenko, Andrey Y.; Cibulskis, Kristian; Gabriel, Stacey B.; Altshuler, David; Daly, Mark J.",,,,NATURE GENETICS,May-11,2011,43,5,491,+,,10.1038/ng.806,4235,470.56,0,0,0,0,0,0,0,0,0,0,0,0,0,0,24,180,316,518,656,711,745
Generalized lacZ expression with the ROSA26 Cre reporter strain,"Soriano, P",,,,NATURE GENETICS,Jan-99,1999,21,1,70,71,,10.1038/5007,3753,178.71,0,0,5,40,55,91,90,142,177,205,235,284,280,268,308,308,255,249,234,193,155
PGC-1 alpha-responsive genes involved in oxidative phosphorylation are coordinately downregulated in human diabetes,"Mootha, VK; Lindgren, CM; Eriksson, KF; Subramanian, A; Sihag, S; Lehar, J; Puigserver, P; Carlsson, E; Ridderstrale, M; Laurila, E; Houstis, N; Daly, MJ; Patterson, N; Mesirov, JP; Golub, TR; Tamayo, P; Spiegelman, B; Lander, ES; Hirschhorn, JN; Altshuler, D; Groop, LC",,,,NATURE GENETICS,Jul-03,2003,34,3,267,273,,10.1038/ng1180,3624,213.18,0,0,0,0,0,0,7,72,152,181,193,211,217,253,235,256,230,245,244,270,319
Epigenetic regulation of gene expression: how the genome integrates intrinsic and environmental signals,"Jaenisch, R; Bird, A",,,,NATURE GENETICS,Mar-03,2003,33,,245,254,,10.1038/ng1089,3426,201.53,0,0,0,0,0,0,35,127,143,157,172,159,141,205,232,241,248,272,241,310,332
Combinatorial microRNA target predictions,"Krek, A; Grun, D; Poy, MN; Wolf, R; Rosenberg, L; Epstein, EJ; MacMenamin, P; da Piedade, I; Gunsalus, KC; Stoffel, M; Rajewsky, N",,,,NATURE GENETICS,May-05,2005,37,5,495,500,,10.1038/ng1536,3263,217.53,0,0,0,0,0,0,0,0,32,90,161,193,245,282,301,285,295,327,309,242,226
"Rett syndrome is caused by mutations in X-linked MECP2, encoding methyl-CpG-binding protein 2","Amir, RE; Van den Veyver, IB; Wan, M; Tran, CQ; Francke, U; Zoghbi, HY",,,,NATURE GENETICS,Oct-99,1999,23,2,185,188,,10.1038/13810,2874,136.86,0,0,8,71,136,86,91,86,100,117,112,116,133,158,195,179,207,209,195,222,194
Minimum information about a microarray experiment (MIAME) - toward standards for microarray data,"Brazma, A; Hingamp, P; Quackenbush, J; Sherlock, G; Spellman, P; Stoeckert, C; Aach, J; Ansorge, W; Ball, CA; Causton, HC; Gaasterland, T; Glenisson, P; Holstege, FCP; Kim, IF; Markowitz, V; Matese, JC; Parkinson, H; Robinson, A; Sarkans, U; Schulze-Kremer, S; Stewart, J; Taylor, R; Vilo, J; Vingron, M",,,,NATURE GENETICS,Dec-01,2001,29,4,365,371,,10.1038/ng1201-365,2728,143.58,0,0,0,0,1,58,129,178,238,260,232,208,210,195,188,186,132,119,92,101,87
Ala30Pro mutation in the gene encoding alpha-synuclein in Parkinson's disease,"Kruger, R; Kuhn, W; Muller, T; Woitalla, D; Graeber, M; Kosel, S; Przuntek, H; Epplen, JT; Schols, L; Riess, O",,,,NATURE GENETICS,Feb-98,1998,18,2,106,108,,10.1038/ng0298-106,2700,122.73,0,49,86,116,137,139,154,149,133,141,115,150,136,134,153,131,152,112,127,96,124
Merlin-rapid analysis of dense genetic maps using sparse gene flow trees,"Abecasis, GR; Cherny, SS; Cookson, WO; Cardon, LR",,,,NATURE GENETICS,Jan-02,2002,30,1,97,101,,10.1038/ng786,2527,140.39,0,0,0,0,0,8,65,120,189,174,236,226,247,197,207,156,153,134,140,101,81
"Quantitative expression of Oct-3/4 defines differentiation, dedifferentiation or self-renewal of ES cells","Niwa, H; Miyazaki, J; Smith, AG",,,,NATURE GENETICS,Apr-00,2000,24,4,372,376,,10.1038/74199,2462,123.1,0,0,0,11,32,43,66,108,145,155,147,170,176,180,198,199,172,179,139,104,116
"Identification of a candidate tumour suppressor gene, MMAC1, at chromosome 10q23.3 that is mutated in multiple advanced cancers","Steck, PA; Pershouse, MA; Jasser, SA; Yung, WKA; Lin, H; Ligon, AH; Langford, LA; Baumgard, ML; Hattier, T; Davis, T; Frye, C; Hu, R; Swedlund, B; Teng, DHF; Tavtigian, SV",,,,NATURE GENETICS,Apr-97,1997,15,4,356,362,,10.1038/ng0497-356,2181,94.83,48,169,156,161,152,149,118,103,90,92,97,87,89,76,86,71,86,80,84,52,53
Reanalysis and revision of the Cambridge reference sequence for human mitochondrial DNA,"Andrews, RM; Kubacka, I; Chinnery, PF; Lightowlers, RN; Turnbull, DM; Howell, N",,,,NATURE GENETICS,Oct-99,1999,23,2,147,147,,,1983,94.43,0,0,0,17,30,41,63,72,64,85,91,120,116,138,131,145,126,123,143,135,156
"The immune dysregulation, polyendocrinopathy, enteropathy, X-linked syndrome (IPEX) is caused by mutations of FOXP3","Bennett, CL; Christie, J; Ramsdell, F; Brunkow, ME; Ferguson, PJ; Whitesell, L; Kelly, TE; Saulsbury, FT; Chance, PF; Ochs, HD",,,,NATURE GENETICS,Jan-01,2001,27,1,20,21,,,1952,102.74,0,0,0,0,20,17,22,46,84,111,129,137,138,134,150,155,132,123,126,122,128
Common SNPs explain a large proportion of the heritability for human height,"Yang, Jian; Benyamin, Beben; McEvoy, Brian P.; Gordon, Scott; Henders, Anjali K.; Nyholt, Dale R.; Madden, Pamela A.; Heath, Andrew C.; Martin, Nicholas G.; Montgomery, Grant W.; Goddard, Michael E.; Visscher, Peter M.",,,,NATURE GENETICS,Jul-10,2010,42,7,565,U131,,10.1038/ng.608,1917,191.7,0,0,0,0,0,0,0,0,0,0,0,0,0,33,150,184,227,262,264,224,249
A general framework for estimating the relative pathogenicity of human genetic variants,"Kircher, Martin; Witten, Daniela M.; Jain, Preti; O'Roak, Brian J.; Cooper, Gregory M.; Shendure, Jay",,,,NATURE GENETICS,Mar-14,2014,46,3,310,+,,10.1038/ng.2892,1887,314.5,0,0,0,0,0,0,0,0,0,0,0,0,0,0,0,0,0,47,215,332,451
Detection of large-scale variation in the human genome,"Iafrate, AJ; Feuk, L; Rivera, MN; Listewnik, ML; Donahoe, PK; Qi, Y; Scherer, SW; Lee, C",,,,NATURE GENETICS,Sep-04,2004,36,9,949,951,,10.1038/ng1416,1865,116.56,0,0,0,0,0,0,0,4,94,141,173,185,176,203,167,157,152,118,108,58,69
Effective targeted gene 'knockdown' in zebrafish,"Nasevicius, A; Ekker, SC",,,,NATURE GENETICS,Oct-00,2000,26,2,216,220,,10.1038/79951,1838,91.9,0,0,0,3,73,132,118,159,128,120,113,134,111,109,108,102,99,78,69,63,47
Methylated DNA and MeCP2 recruit histone deacetylase to repress transcription,"Jones, PL; Veenstra, GJC; Wade, PA; Vermaak, D; Kass, SU; Landsberger, N; Strouboulis, J; Wolffe, AP",,,,NATURE GENETICS,Jun-98,1998,19,2,187,191,,10.1038/561,1825,82.95,0,23,121,131,141,113,106,83,93,73,76,78,76,66,102,80,80,82,85,74,62
Distinct and predictive chromatin signatures of transcriptional promoters and enhancers in the human genome,"Heintzman, Nathaniel D.; Stuart, Rhona K.; Hon, Gary; Fu, Yutao; Ching, Christina W.; Hawkins, R. David; Barrera, Leah O.; Van Calcar, Sara; Qu, Chunxu; Ching, Keith A.; Wang, Wei; Weng, Zhiping; Green, Roland D.; Crawford, Gregory E.; Ren, Bing",,,,NATURE GENETICS,Mar-07,2007,39,3,311,318,,10.1038/ng1966,1817,139.77,0,0,0,0,0,0,0,0,0,0,30,87,94,145,164,197,180,177,197,162,160
Cancer epigenetics comes of age,"Jones, PA; Laird, PW",,,,NATURE GENETICS,Feb-99,1999,21,2,163,167,,10.1038/5947,1776,84.57,0,0,29,93,134,178,150,122,122,123,121,102,74,90,70,85,53,52,55,37,43
Genome-wide association defines more than 30 distinct susceptibility loci for Crohn's disease,"Barrett, Jeffrey C.; Hansoul, Sarah; Nicolae, Dan L.; Cho, Judy H.; Duerr, Richard H.; Rioux, John D.; Brant, Steven R.; Silverberg, Mark S.; Taylor, Kent D.; Barmada, M. Michael; Bitton, Alain; Dassopoulos, Themistocles; Datta, Lisa Wu; Green, Todd; Griffiths, Anne M.; Kistner, Emily O.; Murtha, Michael T.; Regueiro, Miguel D.; Rotter, Jerome I.; Schumm, L. Philip; Steinhart, A. Hillary; Targan, Stephan R.; Xavier, Ramnik J.; Libioulle, Cecile; Sandor, Cynthia; Lathrop, Mark; Belaiche, Jacques; Dewit, Olivier; Gut, Ivo; Heath, Simon; Laukens, Debby; Mni, Myriam; Rutgeerts, Paul; Van Gossum, Andre; Zelenika, Diana; Franchimont, Denis; Hugot, Jean-Pierre; de Vos, Martine; Vermeire, Severine; Louis, Edouard; Cardon, Lon R.; Anderson, Carl A.; Drummond, Hazel; Nimmo, Elaine; Ahmad, Tariq; Prescott, Natalie J.; Onnie, Clive M.; Fisher, Sheila A.; Marchini, Jonathan; Ghori, Jilur; Bumpstead, Suzannah; Gwilliam, Rhian; Tremelling, Mark; Deloukas, Panos; Mansfield, John; Jewell, Derek; Satsangi, Jack; Mathew, Christopher G.; Parkes, Miles; Georges, Michel; Daly, Mark J.",NIDDK IBD Genetics Consortium; Belgian-French IBD Consortium; Wellcome Trust Case Control,,,NATURE GENETICS,Aug-08,2008,40,8,955,962,,10.1038/ng.175,1770,147.5,0,0,0,0,0,0,0,0,0,0,0,20,203,265,264,210,181,146,119,112,97
A unified mixed-model method for association mapping that accounts for multiple levels of relatedness,"Yu, JM; Pressoir, G; Briggs, WH; Bi, IV; Yamasaki, M; Doebley, JF; McMullen, MD; Gaut, BS; Nielsen, DM; Holland, JB; Kresovich, S; Buckler, ES",,,,NATURE GENETICS,Feb-06,2006,38,2,203,208,,10.1038/ng1702,1763,125.93,0,0,0,0,0,0,0,0,0,14,42,60,65,86,122,143,148,171,187,207,205
Deep surveying of alternative splicing complexity in the human transcriptome by high-throughput sequencing,"Pan, Qun; Shai, Ofer; Lee, Leo J.; Frey, J.; Blencowe, Benjamin J.",,,,NATURE GENETICS,Dec-08,2008,40,12,1413,1415,,10.1038/ng.259,1723,143.58,0,0,0,0,0,0,0,0,0,0,0,0,61,149,138,187,199,198,185,171,181
"Association analyses of 249,796 individuals reveal 18 new loci associated with body mass index","Speliotes, Elizabeth K.; Willer, Cristen J.; Berndt, Sonja I.; Monda, Keri L.; Thorleifsson, Gudmar; Jackson, Anne U.; Allen, Hana Lango; Lindgren, Cecilia M.; Luan, Jian'an; Maegi, Reedik; Randall, Joshua C.; Vedantam, Sailaja; Winkler, Thomas W.; Qi, Lu; Workalemahu, Tsegaselassie; Heid, Iris M.; Steinthorsdottir, Valgerdur; Stringham, Heather M.; Weedon, Michael N.; Wheeler, Eleanor; Wood, Andrew R.; Ferreira, Teresa; Weyant, Robert J.; Segre, Ayellet V.; Estrada, Karol; Liang, Liming; Nemesh, James; Park, Ju-Hyun; Gustafsson, Stefan; Kilpelaenen, Tuomas O.; Yang, Jian; Bouatia-Naji, Nabila; Esko, Tonu; Feitosa, Mary F.; Kutalik, Zoltan; Mangino, Massimo; Raychaudhuri, Soumya; Scherag, Andre; Smith, Albert Vernon; Welch, Ryan; Zhao, Jing Hua; Aben, Katja K.; Absher, Devin M.; Amin, Najaf; Dixon, Anna L.; Fisher, Eva; Glazer, Nicole L.; Goddard, Michael E.; Heard-Costa, Nancy L.; Hoesel, Volker; Hottenga, Jouke-Jan; Johansson, Asa; Johnson, Toby; Ketkar, Shamika; Lamina, Claudia; Li, Shengxu; Moffatt, Miriam F.; Myers, Richard H.; Narisu, Narisu; Perry, John R. B.; Peters, Marjolein J.; Preuss, Michael; Ripatti, Samuli; Rivadeneira, Fernando; Sandholt, Camilla; Scott, Laura J.; Timpson, Nicholas J.; Tyrer, Jonathan P.; van Wingerden, Sophie; Watanabe, Richard M.; White, Charles C.; Wiklund, Fredrik; Barlassina, Christina; Chasman, Daniel I.; Cooper, Matthew N.; Jansson, John-Olov; Lawrence, Robert W.; Pellikka, Niina; Prokopenko, Inga; Shi, Jianxin; Thiering, Elisabeth; Alavere, Helene; Alibrandi, Maria T. S.; Almgren, Peter; Arnold, Alice M.; Aspelund, Thor; Atwood, Larry D.; Balkau, Beverley; Balmforth, Anthony J.; Bennett, Amanda J.; Ben-Shlomo, Yoav; Bergman, Richard N.; Bergmann, Sven; Biebermann, Heike; Blakemore, Alexandra I. F.; Boes, Tanja; Bonnycastle, Lori L.; Bornstein, Stefan R.; Brown, Morris J.; Buchanan, Thomas A.; Busonero, Fabio; Campbell, Harry; Cappuccio, Francesco P.; Cavalcanti-Proenca, Christine; Chen, Yii-Der Ida; Chen, Chih-Mei; Chines, Peter S.; Clarke, Robert; Coin, Lachlan; Connell, John; Day, Ian N. M.; den Heijer, Martin; Duan, Jubao; Ebrahim, Shah; Elliott, Paul; Elosua, Roberto; Eiriksdottir, Gudny; Erdos, Michael R.; Eriksson, Johan G.; Facheris, Maurizio F.; Felix, Stephan B.; Fischer-Posovszky, Pamela; Folsom, Aaron R.; Friedrich, Nele; Freimer, Nelson B.; Fu, Mao; Gaget, Stefan; Gejman, Pablo V.; Geus, Eco J. C.; Gieger, Christian; Gjesing, Anette P.; Goel, Anuj; Goyette, Philippe; Grallert, Harald; Graessler, Juergen; Greenawalt, Danielle M.; Groves, Christopher J.; Gudnason, Vilmundur; Guiducci, Candace; Hartikainen, Anna-Liisa; Hassanali, Neelam; Hall, Alistair S.; Havulinna, Aki S.; Hayward, Caroline; Heath, Andrew C.; Hengstenberg, Christian; Hicks, Andrew A.; Hinney, Anke; Hofman, Albert; Homuth, Georg; Hui, Jennie; Igl, Wilmar; Iribarren, Carlos; Isomaa, Bo; Jacobs, Kevin B.; Jarick, Ivonne; Jewell, Elizabeth; John, Ulrich; Jorgensen, Torben; Jousilahti, Pekka; Jula, Antti; Kaakinen, Marika; Kajantie, Eero; Kaplan, Lee M.; Kathiresan, Sekar; Kettunen, Johannes; Kinnunen, Leena; Knowles, Joshua W.; Kolcic, Ivana; Koenig, Inke R.; Koskinen, Seppo; Kovacs, Peter; Kuusisto, Johanna; Kraft, Peter; Kvaloy, Kirsti; Laitinen, Jaana; Lantieri, Olivier; Lanzani, Chiara; Launer, Lenore J.; Lecoeur, Cecile; Lehtimaeki, Terho; Lettre, Guillaume; Liu, Jianjun; Lokki, Marja-Liisa; Lorentzon, Mattias; Luben, Robert N.; Ludwig, Barbara; Manunta, Paolo; Marek, Diana; Marre, Michel; Martin, Nicholas G.; McArdle, Wendy L.; McCarthy, Anne; McKnight, Barbara; Meitinger, Thomas; Melander, Olle; Meyre, David; Midthjell, Kristian; Montgomery, Grant W.; Morken, Mario A.; Morris, Andrew P.; Mulic, Rosanda; Ngwa, Julius S.; Nelis, Mari; Neville, Matt J.; Nyholt, Dale R.; O'Donnell, Christopher J.; O'Rahilly, Stephen; Ong, Ken K.; Oostra, Ben; Pare, Guillaume; Parker, Alex N.; Perola, Markus; Pichler, Irene; Pietilaeinen, Kirsi H.; Platou, Carl G. P.; Polasek, Ozren; Pouta, Anneli; Rafelt, Suzanne; Raitakari, Olli; Rayner, Nigel W.; Ridderstrale, Martin; Rief, Winfried; Ruokonen, Aimo; Robertson, Neil R.; Rzehak, Peter; Salomaa, Veikko; Sanders, Alan R.; Sandhu, Manjinder S.; Sanna, Serena; Saramies, Jouko; Savolainen, Markku J.; Scherag, Susann; Schipf, Sabine; Schreiber, Stefan; Schunkert, Heribert; Silander, Kaisa; Sinisalo, Juha; Siscovick, David S.; Smit, Jan H.; Soranzo, Nicole; Sovio, Ulla; Stephens, Jonathan; Surakka, Ida; Swift, Amy J.; Tammesoo, Mari-Liis; Tardif, Jean-Claude; Teder-Laving, Maris; Teslovich, Tanya M.; Thompson, John R.; Thomson, Brian; Toenjes, Anke; Tuomi, Tiinamaija; van Meurs, Joyce B. J.; van Ommen, Gert-Jan; Vatin, Vincent; Viikari, Jorma; Visvikis-Siest, Sophie; Vitart, Veronique; Vogel, Carla I. G.; Voight, Benjamin F.; Waite, Lindsay L.; Wallaschofski, Henri; Walters, G. Bragi; Widen, Elisabeth; Wiegand, Susanna; Wild, Sarah H.; Willemsen, Gonneke; Witte, Daniel R.; Witteman, Jacqueline C.; Xu, Jianfeng; Zhang, Qunyuan; Zgaga, Lina; Ziegler, Andreas; Zitting, Paavo; Beilby, John P.; Farooqi, I. Sadaf; Hebebrand, Johannes; Huikuri, Heikki V.; James, Alan L.; Kaehoenen, Mika; Levinson, Douglas F.; Macciardi, Fabio; Nieminen, Markku S.; Ohlsson, Claes; Palmer, Lyle J.; Ridker, Paul M.; Stumvoll, Michael; Beckmann, Jacques S.; Boeing, Heiner; Boerwinkle, Eric; Boomsma, Dorret I.; Caulfield, Mark J.; Chanock, Stephen J.; Collins, Francis S.; Cupples, L. Adrienne; Smith, George Davey; Erdmann, Jeanette; Froguel, Philippe; Greonberg, Henrik; Gyllensten, Ulf; Hall, Per; Hansen, Torben; Harris, Tamara B.; Hattersley, Andrew T.; Hayes, Richard B.; Heinrich, Joachim; Hu, Frank B.; Hveem, Kristian; Illig, Thomas; Jarvelin, Marjo-Riitta; Kaprio, Jaakko; Karpe, Fredrik; Khaw, Kay-Tee; Kiemeney, Lambertus A.; Krude, Heiko; Laakso, Markku; Lawlor, Debbie A.; Metspalu, Andres; Munroe, Patricia B.; Ouwehand, Willem H.; Pedersen, Oluf; Penninx, Brenda W.; Peters, Annette; Pramstaller, Peter P.; Quertermous, Thomas; Reinehr, Thomas; Rissanen, Aila; Rudan, Igor; Samani, Nilesh J.; Schwarz, Peter E. H.; Shuldiner, Alan R.; Spector, Timothy D.; Tuomilehto, Jaakko; Uda, Manuela; Uitterlinden, Andre; Valle, Timo T.; Wabitsch, Martin; Waeber, Gerard; Wareham, Nicholas J.; Watkins, Hugh; Wilson, James F.; Wright, Alan F.; Zillikens, M. Carola; Chatterjee, Nilanjan; McCarroll, Steven A.; Purcell, Shaun; Schadt, Eric E.; Visscher, Peter M.; Assimes, Themistocles L.; Borecki, Ingrid B.; Deloukas, Panos; Fox, Caroline S.; Groop, Leif C.; Haritunians, Talin; Hunter, David J.; Kaplan, Robert C.; Mohlke, Karen L.; O'Connell, Jeffrey R.; Peltonen, Leena; Schlessinger, David; Strachan, David P.; van Duijn, Cornelia M.; Wichmann, H-Erich; Frayling, Timothy M.; Thorsteinsdottir, Unnur; Abecasis, Goncalo R.; Barroso, Ines; Boehnke, Michael; Stefansson, Kari; North, Kari E.; McCarthy, Mark I.; Hirschhorn, Joel N.; Ingelsson, Erik; Loos, Ruth J. F.",MAGIC,,,NATURE GENETICS,Nov-10,2010,42,11,937,U53,,10.1038/ng.686,1701,170.1,0,0,0,0,0,0,0,0,0,0,0,0,0,6,115,223,260,249,253,186,182
The role of microRNA-1 and microRNA-133 in skeletal muscle proliferation and differentiation,"Chen, JF; Mandel, EM; Thomson, JM; Wu, QL; Callis, TE; Hammond, SM; Conlon, FL; Wang, DZ",,,,NATURE GENETICS,Feb-06,2006,38,2,228,233,,10.1038/ng1725,1689,120.64,0,0,0,0,0,0,0,0,0,28,71,102,113,139,143,149,159,153,165,141,142
Genome-wide association of IL28B with response to pegylated interferon-alpha and ribavirin therapy for chronic hepatitis C,"Tanaka, Yasuhito; Nishida, Nao; Sugiyama, Masaya; Kurosaki, Masayuki; Matsuura, Kentaro; Sakamoto, Naoya; Nakagawa, Mina; Korenaga, Masaaki; Hino, Keisuke; Hige, Shuhei; Ito, Yoshito; Mita, Eiji; Tanaka, Eiji; Mochida, Satoshi; Murawaki, Yoshikazu; Honda, Masao; Sakai, Akito; Hiasa, Yoichi; Nishiguchi, Shuhei; Koike, Asako; Sakaida, Isao; Imamura, Masatoshi; Ito, Kiyoaki; Yano, Koji; Masaki, Naohiko; Sugauchi, Fuminaka; Izumi, Namiki; Tokunaga, Katsushi; Mizokami, Masashi",,,,NATURE GENETICS,Oct-09,2009,41,10,1105,U81,,10.1038/ng.449,1682,152.91,0,0,0,0,0,0,0,0,0,0,0,0,5,110,281,326,231,263,185,106,101
A molecular signature of metastasis in primary solid tumors,"Ramaswamy, S; Ross, KN; Lander, ES; Golub, TR",,,,NATURE GENETICS,Jan-03,2003,33,1,49,54,,10.1038/ng1060,1664,97.88,0,0,0,0,0,0,58,159,148,148,149,140,130,127,102,101,73,85,54,52,61
TGF-beta signaling in tumor suppression and cancer progression,"Derynck, R; Akhurst, RJ; Balmain, A",,,,NATURE GENETICS,Oct-01,2001,29,2,117,129,,10.1038/ng1001-117,1651,86.89,0,0,0,0,2,54,95,123,111,116,117,93,91,125,101,94,75,98,96,74,83
A gene expression map of Arabidopsis thaliana development,"Schmid, M; Davison, TS; Henz, SR; Pape, UJ; Demar, M; Vingron, M; Scholkopf, B; Weigel, D; Lohmann, JU",,,,NATURE GENETICS,May-05,2005,37,5,501,506,,10.1038/ng1543,1642,109.47,0,0,0,0,0,0,0,0,19,96,108,146,142,155,132,120,137,122,118,117,101
Systematic determination of genetic network architecture,"Tavazoie, S; Hughes, JD; Campbell, MJ; Cho, RJ; Church, GM",,,,NATURE GENETICS,Jul-99,1999,22,3,281,285,,,1634,77.81,0,0,7,54,75,115,122,116,147,126,134,119,109,88,70,74,58,59,36,36,44
Network motifs in the transcriptional regulation network of Escherichia coli,"Shen-Orr, SS; Milo, R; Mangan, S; Alon, U",,,,NATURE GENETICS,May-02,2002,31,1,64,68,,10.1038/ng881,1633,90.72,0,0,0,0,0,8,52,92,98,109,119,122,128,125,123,125,88,91,88,81,63
The Genotype-Tissue Expression (GTEx) project,"Lonsdale, John; Thomas, Jeffrey; Salvatore, Mike; Phillips, Rebecca; Lo, Edmund; Shad, Saboor; Hasz, Richard; Walters, Gary; Garcia, Fernando; Young, Nancy; Foster, Barbara; Moser, Mike; Karasik, Ellen; Gillard, Bryan; Ramsey, Kimberley; Sullivan, Susan; Bridge, Jason; Magazine, Harold; Syron, John; Fleming, Johnelle; Siminoff, Laura; Traino, Heather; Mosavel, Maghboeba; Barker, Laura; Jewell, Scott; Rohrer, Dan; Maxim, Dan; Filkins, Dana; Harbach, Philip; Cortadillo, Eddie; Berghuis, Bree; Turner, Lisa; Hudson, Eric; Feenstra, Kristin; Sobin, Leslie; Robb, James; Branton, Phillip; Korzeniewski, Greg; Shive, Charles; Tabor, David; Qi, Liqun; Groch, Kevin; Nampally, Sreenath; Buia, Steve; Zimmerman, Angela; Smith, Anna; Burges, Robin; Robinson, Karna; Valentino, Kim; Bradbury, Deborah; Cosentino, Mark; Diaz-Mayoral, Norma; Kennedy, Mary; Engel, Theresa; Williams, Penelope; Erickson, Kenyon; Ardlie, Kristin; Winckler, Wendy; Getz, Gad; DeLuca, David; MacArthur, Daniel; Kellis, Manolis; Thomson, Alexander; Young, Taylor; Gelfand, Ellen; Donovan, Molly; Meng, Yan; Grant, George; Mash, Deborah; Marcus, Yvonne; Basile, Margaret; Liu, Jun; Zhu, Jun; Tu, Zhidong; Cox, Nancy J.; Nicolae, Dan L.; Gamazon, Eric R.; Im, Hae Kyung; Konkashbaev, Anuar; Pritchard, Jonathan; Stevens, Matthew; Flutre, Timothee; Wen, Xiaoquan; Dermitzakis, Emmanouil T.; Lappalainen, Tuuli; Guigo, Roderic; Monlong, Jean; Sammeth, Michael; Koller, Daphne; Battle, Alexis; Mostafavi, Sara; McCarthy, Mark; Rivas, Manual; Maller, Julian; Rusyn, Ivan; Nobel, Andrew; Wright, Fred; Shabalin, Andrey; Feolo, Mike; Sharopova, Nataliya; Sturcke, Anne; Paschal, Justin; Anderson, James M.; Wilder, Elizabeth L.; Derr, Leslie K.; Green, Eric D.; Struewing, Jeffery P.; Temple, Gary; Volpi, Simona; Boyer, Joy T.; Thomson, Elizabeth J.; Guyer, Mark S.; Cathy Ng; Abdallah, Assya; Colantuoni, Deborah; Insel, Thomas R.; Koester, Susan E.; Little, A. Roger; Bender, Patrick K.; Lehner, Thomas; Yao, Yin; Compton, Carolyn C.; Vaught, Jimmie B.; Sawyer, Sherilyn; Lockhart, Nicole C.; Demchok, Joanne; Moore, Helen F.",,,,NATURE GENETICS,Jun-13,2013,45,6,580,585,,10.1038/ng.2653,1631,233,0,0,0,0,0,0,0,0,0,0,0,0,0,0,0,0,6,93,169,239,374
The Oct4 and Nanog transcription network regulates pluripotency in mouse embryonic stem cells,"Loh, YH; Wu, Q; Chew, JL; Vega, VB; Zhang, WW; Chen, X; Bourque, G; George, J; Leong, B; Liu, J; Wong, KY; Sung, KW; Lee, CWH; Zhao, XD; Chiu, KP; Lipovich, L; Kuznetsov, VA; Robson, P; Stanton, LW; Wei, CL; Ruan, YJ; Lim, B; Ng, HH",,,,NATURE GENETICS,Apr-06,2006,38,4,431,440,,10.1038/ng1760,1631,116.5,0,0,0,0,0,0,0,0,0,39,109,154,171,153,146,143,159,125,122,93,84
Exploring the new world of the genome with DNA microarrays,"Brown, PO; Botstein, D",,,,NATURE GENETICS,Jan-99,1999,21,,33,37,,10.1038/4462,1631,77.67,0,0,40,122,163,182,149,155,117,107,81,70,72,65,62,48,45,40,33,29,19
Common loss-of-function variants of the epidermal barrier protein filaggrin are a major predisposing factor for atopic dermatitis,"Palmer, CNA; Irvine, AD; Terron-Kwiatkowski, A; Zhao, YW; Liao, HH; Lee, SP; Goudie, DR; Sandilands, A; Campbell, LE; Smith, FJD; O'Regan, GM; Watson, RM; Cecil, JE; Bale, SJ; Compton, JG; DiGiovanna, JJ; Fleckman, P; Lewis-Jones, S; Arseculeratne, G; Sergeant, A; Munro, CS; El Houate, B; McElreavey, K; Halkjaer, LB; Bisgaard, H; Mukhopadhyay, S; McLean, WHI",,,,NATURE GENETICS,Apr-06,2006,38,4,441,446,,10.1038/ng1767,1622,115.86,0,0,0,0,0,0,0,0,0,35,84,128,135,129,129,139,125,129,125,142,140
A new multipoint method for genome-wide association studies by imputation of genotypes,"Marchini, Jonathan; Howie, Bryan; Myers, Simon; McVean, Gil; Donnelly, Peter",,,,NATURE GENETICS,Jul-07,2007,39,7,906,913,,10.1038/ng2088,1592,122.46,0,0,0,0,0,0,0,0,0,0,7,81,154,166,163,148,139,132,147,116,144
Genome-wide association study identifies variants at CLU and PICALM associated with Alzheimer's disease,"Harold, Denise; Abraham, Richard; Hollingworth, Paul; Sims, Rebecca; Gerrish, Amy; Hamshere, Marian L.; Pahwa, Jaspreet Singh; Moskvina, Valentina; Dowzell, Kimberley; Williams, Amy; Jones, Nicola; Thomas, Charlene; Stretton, Alexandra; Morgan, Angharad R.; Lovestone, Simon; Powell, John; Proitsi, Petroula; Lupton, Michelle K.; Brayne, Carol; Rubinsztein, David C.; Gill, Michael; Lawlor, Brian; Lynch, Aoibhinn; Morgan, Kevin; Brown, Kristelle S.; Passmore, Peter A.; Craig, David; McGuinness, Bernadette; Todd, Stephen; Holmes, Clive; Mann, David; Smith, A. David; Love, Seth; Kehoe, Patrick G.; Hardy, John; Mead, Simon; Fox, Nick; Rossor, Martin; Collinge, John; Maier, Wolfgang; Jessen, Frank; Schuermann, Britta; van den Bussche, Hendrik; Heuser, Isabella; Kornhuber, Johannes; Wiltfang, Jens; Dichgans, Martin; Froelich, Lutz; Hampel, Harald; Huell, Michael; Rujescu, Dan; Goate, Alison M.; Kauwe, John S. K.; Cruchaga, Carlos; Nowotny, Petra; Morris, John C.; Mayo, Kevin; Sleegers, Kristel; Bettens, Karolien; Engelborghs, Sebastiaan; De Deyn, Peter P.; Van Broeckhoven, Christine; Livingston, Gill; Bass, Nicholas J.; Gurling, Hugh; McQuillin, Andrew; Gwilliam, Rhian; Deloukas, Panagiotis; Al-Chalabi, Ammar; Shaw, Christopher E.; Tsolaki, Magda; Singleton, Andrew B.; Guerreiro, Rita; Muehleisen, Thomas W.; Noethen, Markus M.; Moebus, Susanne; Joeckel, Karl-Heinz; Klopp, Norman; Wichmann, H-Erich; Carrasquillo, Minerva M.; Pankratz, V. Shane; Younkin, Steven G.; Holmans, Peter A.; O'Donovan, Michael; Owen, Michael J.; Williams, Julie",,,,NATURE GENETICS,Oct-09,2009,41,10,1088,U61,,10.1038/ng.440,1565,142.27,0,0,0,0,0,0,0,0,0,0,0,0,9,136,176,191,182,182,162,179,141
Systematic variation in gene expression patterns in human cancer cell lines,"Ross, DT; Scherf, U; Eisen, MB; Perou, CM; Rees, C; Spellman, P; Iyer, V; Jeffrey, SS; Van de Rijn, M; Waltham, M; Pergamenschikov, A; Lee, JCE; Lashkari, D; Shalon, D; Myers, TG; Weinstein, JN; Botstein, D; Brown, PO",,,,NATURE GENETICS,Mar-00,2000,24,3,227,235,,10.1038/73432,1565,78.25,0,0,0,35,134,149,132,138,99,103,101,90,98,77,76,61,55,47,52,33,40
